tweet_id,source,text,rating_numerator,rating_denominator,dog_name,dog_class,jpg_url,dog_breed,retweet_count,favorite_count
892177421306343426,Twitter for iPhone,"This is Tilly. She's just checking pup on you. Hopes you're doing ok. If not, she's available for pats, snugs, boops, the whole bit. 13/10 https://t.co/0Xxu71qeIV",13,10,tilly,,https://pbs.twimg.com/media/DGGmoV4XsAAUL6n.jpg,Chihuahua,6514,33819
891815181378084864,Twitter for iPhone,This is Archie. He is a rare Norwegian Pouncing Corgo. Lives in the tall grass. You never know when one may strike. 12/10 https://t.co/wUnZnhtVJB,12,10,archie,,https://pbs.twimg.com/media/DGBdLU1WsAANxJ9.jpg,Chihuahua,4328,25461
891327558926688256,Twitter for iPhone,"This is Franklin. He would like you to stop calling him ""cute."" He is a very fierce shark and should be respected as such. 12/10 #BarkWeek https://t.co/AtUZn91f7f",12,10,franklin,,https://pbs.twimg.com/media/DF6hr6BUMAAzZgT.jpg,basset,9774,41048
891087950875897856,Twitter for iPhone,Here we have a majestic great white breaching off South Africa's coast. Absolutely h*ckin breathtaking. 13/10 (IG: tucker_marlo) #BarkWeek https://t.co/kQ04fDDRmh,13,10,,,https://pbs.twimg.com/media/DF3HwyEWsAABqE6.jpg,Chesapeake_Bay_retriever,3261,20562
890971913173991426,Twitter for iPhone,"Meet Jax. He enjoys ice cream so much he gets nervous around it. 13/10 help Jax enjoy more things by clicking below

https://t.co/Zr4hWfAs1H https://t.co/tVJBRMnhxl",13,10,jax,,https://pbs.twimg.com/media/DF1eOmZXUAALUcq.jpg,Appenzeller,2158,12041
890729181411237888,Twitter for iPhone,When you watch your owner call another dog a good boy but then they turn back to you and say you're a great boy. 13/10 https://t.co/v0nONBcwxq,13,10,,,https://pbs.twimg.com/media/DFyBahAVwAAhUTd.jpg,Pomeranian,16716,56848
890609185150312448,Twitter for iPhone,This is Zoey. She doesn't want to be one of the scary sharks. Just wants to be a snuggly pettable boatpet. 13/10 #BarkWeek https://t.co/9TwLuAGH0b,13,10,zoey,,https://pbs.twimg.com/media/DFwUU__XcAEpyXI.jpg,Irish_terrier,4429,28226
890240255349198849,Twitter for iPhone,This is Cassie. She is a college pup. Studying international doggo communication and stick theory. 14/10 so elegant much sophisticate https://t.co/t1bfwz5S2A,14,10,cassie,doggo,https://pbs.twimg.com/media/DFrEyVuW0AAO3t9.jpg,Pembroke,7711,32467
890006608113172480,Twitter for iPhone,This is Koda. He is a South Australian deckshark. Deceptively deadly. Frighteningly majestic. 13/10 would risk a petting #BarkWeek https://t.co/dVPW0B0Mme,13,10,koda,,https://pbs.twimg.com/media/DFnwSY4WAAAMliS.jpg,Samoyed,7624,31166
889880896479866881,Twitter for iPhone,This is Bruno. He is a service shark. Only gets out of the water to assist you. 13/10 terrifyingly good boy https://t.co/u1XPQMl29g,13,10,bruno,,https://pbs.twimg.com/media/DFl99B1WsAITKsg.jpg,French_bulldog,5156,28268
889665388333682689,Twitter for iPhone,Here's a puppo that seems to be on the fence about something haha no but seriously someone help her. 13/10 https://t.co/BxvuXk0UCm,13,10,,puppo,https://pbs.twimg.com/media/DFi579UWsAAatzw.jpg,Pembroke,8538,38818
889638837579907072,Twitter for iPhone,This is Ted. He does his best. Sometimes that's not enough. But it's ok. 12/10 would assist https://t.co/f8dEDcrKSR,12,10,ted,,https://pbs.twimg.com/media/DFihzFfXsAYGDPR.jpg,French_bulldog,4735,27672
889531135344209921,Twitter for iPhone,This is Stuart. He's sporting his favorite fanny pack. Secretly filled with bones only. 13/10 puppared puppo #BarkWeek https://t.co/y70o6h3isq,13,10,stuart,puppo,https://pbs.twimg.com/media/DFg_2PVW0AEHN3p.jpg,golden_retriever,2321,15359
889278841981685760,Twitter for iPhone,This is Oliver. You're witnessing one of his many brutal attacks. Seems to be playing with his victim. 13/10 fr*ckin frightening #BarkWeek https://t.co/WpHvrQedPb,13,10,oliver,,https://pbs.twimg.com/ext_tw_video_thumb/889278779352338437/pu/img/VlbFB3v8H8VwzVNY.jpg,whippet,5637,25652
888917238123831296,Twitter for iPhone,This is Jim. He found a fren. Taught him how to sit like the good boys. 12/10 for both https://t.co/chxruIOUJN,12,10,jim,,https://pbs.twimg.com/media/DFYRgsOUQAARGhO.jpg,golden_retriever,4709,29611
888804989199671297,Twitter for iPhone,This is Zeke. He has a new stick. Very proud of it. Would like you to throw it for him without taking it. 13/10 would do my best https://t.co/HTQ77yNQ5K,13,10,zeke,,https://pbs.twimg.com/media/DFWra-3VYAA2piG.jpg,golden_retriever,4559,26080
888554962724278272,Twitter for iPhone,This is Ralphus. He's powering up. Attempting maximum borkdrive. 13/10 inspirational af https://t.co/YnYAFCTTiK,13,10,ralphus,,https://pbs.twimg.com/media/DFTH_O-UQAACu20.jpg,Siberian_husky,3732,20290
888078434458587136,Twitter for iPhone,This is Gerald. He was just told he didn't get the job he interviewed for. A h*ckin injustice. 12/10 didn't want the job anyway https://t.co/DK7iDPfuRX,12,10,gerald,,https://pbs.twimg.com/media/DFMWn56WsAAkA7B.jpg,French_bulldog,3653,22201
887705289381826560,Twitter for iPhone,This is Jeffrey. He has a monopoly on the pool noodles. Currently running a 'boop for two' midweek sale. 13/10 h*ckin strategic https://t.co/PhrUk20Q64,13,10,jeffrey,,https://pbs.twimg.com/media/DFHDQBbXgAEqY7t.jpg,basset,5609,30779
887473957103951883,Twitter for iPhone,This is Canela. She attempted some fancy porch pics. They were unsuccessful. 13/10 someone help her https://t.co/cLyzpcUcMX,13,10,canela,,https://pbs.twimg.com/media/DFDw2tyUQAAAFke.jpg,Pembroke,18781,69871
887343217045368832,Twitter for iPhone,You may not have known you needed to see this today. 13/10 please enjoy (IG: emmylouroo) https://t.co/WZqNqygEyV,13,10,,,https://pbs.twimg.com/ext_tw_video_thumb/887343120832229379/pu/img/6HSuFrW1lzI_9Mht.jpg,Mexican_hairless,10737,34222
887101392804085760,Twitter for iPhone,This... is a Jubilant Antarctic House Bear. We only rate dogs. Please only send dogs. Thank you... 12/10 would suffocate in floof https://t.co/4Ad1jzJSdp,12,10,,,https://pbs.twimg.com/media/DE-eAq6UwAA-jaE.jpg,Samoyed,6167,31061
886983233522544640,Twitter for iPhone,This is Maya. She's very shy. Rarely leaves her cup. 13/10 would find her an environment to thrive in https://t.co/I6oNy0CgiT,13,10,maya,,https://pbs.twimg.com/media/DE8yicJW0AAAvBJ.jpg,Chihuahua,8084,35859
886736880519319552,Twitter for iPhone,"This is Mingus. He's a wonderful father to his smol pup. Confirmed 13/10, but he needs your help

https://t.co/bVi0Yr4Cff https://t.co/ISvKOSkd5b",13,10,mingus,,https://pbs.twimg.com/media/DE5Se8FXcAAJFx4.jpg,kuvasz,3443,12306
886366144734445568,Twitter for iPhone,This is Roscoe. Another pupper fallen victim to spontaneous tongue ejections. Get the BlepiPen immediate. 12/10 deep breaths Roscoe https://t.co/RGE08MIJox,12,10,roscoe,pupper,https://pbs.twimg.com/media/DE0BTnQUwAApKEH.jpg,French_bulldog,3316,21524
886258384151887873,Twitter for iPhone,This is Waffles. His doggles are pupside down. Unsure how to fix. 13/10 someone assist Waffles https://t.co/xZDA9Qsq1O,13,10,waffles,,https://pbs.twimg.com/media/DEyfTG4UMAE4aE9.jpg,pug,6523,28469
885984800019947520,Twitter for iPhone,Viewer discretion advised. This is Jimbo. He will rip ur finger right h*ckin off. Other dog clearly an accessory. 12/10 pls pet with caution https://t.co/BuveP0uMF1,12,10,,,https://pbs.twimg.com/media/DEumeWWV0AA-Z61.jpg,Blenheim_spaniel,7097,33382
885528943205470208,Twitter for iPhone,This is Maisey. She fell asleep mid-excavation. Happens to the best of us. 13/10 would pat noggin approvingly https://t.co/tp1kQ8i9JF,13,10,maisey,,https://pbs.twimg.com/media/DEoH3yvXgAAzQtS.jpg,pug,6683,36689
885167619883638784,Twitter for iPhone,Here we have a corgi undercover as a malamute. Pawbably doing important investigative work. Zero control over tongue happenings. 13/10 https://t.co/44ItaMubBf,13,10,,,https://pbs.twimg.com/media/DEi_N9qXYAAgEEw.jpg,malamute,4556,22367
884925521741709313,Twitter for iPhone,"This is Earl. He found a hat. Nervous about what you think of it. 12/10 it's delightful, Earl https://t.co/MYJvdlNRVa",12,10,earl,,https://pbs.twimg.com/media/DEfjEaNXkAAtPlj.jpg,Italian_greyhound,16439,68152
884876753390489601,Twitter for iPhone,This is Lola. It's her first time outside. Must test the earth and taste the atmosphere. 13/10 you're doing great Lola https://t.co/74TKAUsLkO,13,10,lola,,https://pbs.twimg.com/media/DEe2tZXXkAAwyX3.jpg,chow,6096,28514
884562892145688576,Twitter for iPhone,This is Kevin. He's just so happy. 13/10 what is your secret Kevin https://t.co/1r4MFCbCX5,13,10,kevin,,https://pbs.twimg.com/media/DEaZQkfXUAEC7qB.jpg,pug,5100,24765
884441805382717440,Twitter for iPhone,"I present to you, Pup in Hat. Pup in Hat is great for all occasions. Extremely versatile. Compact as h*ck. 14/10 (IG: itselizabethgales) https://t.co/vvBOcC2VdC",14,10,,,https://pbs.twimg.com/media/DEYrIZwWsAA2Wo5.jpg,Pembroke,5856,27478
884162670584377345,Twitter for iPhone,Meet Yogi. He doesn't have any important dog meetings today he just enjoys looking his best at all times. 12/10 for dangerously dapper doggo https://t.co/YSI00BzTBZ,12,10,yogi,doggo,https://pbs.twimg.com/media/DEUtQbzW0AUTv_o.jpg,German_shepherd,3128,20771
883838122936631299,Twitter for iPhone,This is Noah. He can't believe someone made this mess. Got the vacuum out for you though. Offered to help clean pup. 12/10 super good boy https://t.co/V85xujjDDY,12,10,noah,,https://pbs.twimg.com/media/DEQGFgAXUAAEvfi.jpg,Doberman,3586,22349
883482846933004288,Twitter for iPhone,"This is Bella. She hopes her smile made you smile. If not, she is also offering you her favorite monkey. 13.5/10 https://t.co/qjrljjt948",5,10,bella,,https://pbs.twimg.com/media/DELC9dZXUAADqUk.jpg,golden_retriever,10407,46860
883360690899218434,Twitter for iPhone,Meet Grizzwald. He may be the floofiest floofer I ever did see. Lost eyes saving a schoolbus from a volcano erpuption. 13/10 heroic as h*ck https://t.co/rf661IFEYP,13,10,grizzwald,floofer,https://pbs.twimg.com/media/DEJT3FeXoAAtwUy.jpg,chow,3825,22986
883117836046086144,Twitter for iPhone,"Please only send dogs. We don't rate mechanics, no matter how h*ckin good. Thank you... 13/10 would sneak a pat https://t.co/Se5fZ9wp5E",13,10,,,https://pbs.twimg.com/media/DEF2-_hXoAAs62q.jpg,golden_retriever,6949,37914
882992080364220416,Twitter for iPhone,This is Rusty. He wasn't ready for the first pic. Clearly puppared for the second. 13/10 confirmed great boy https://t.co/tyER0KpdXj,13,10,rusty,,https://pbs.twimg.com/media/DEEEnIqXYAAiJh_.jpg,Eskimo_dog,4122,24445
882762694511734784,Twitter for iPhone,This is Gus. He's quite the cheeky pupper. Already perfected the disinterested wink. 12/10 would let steal my girl https://t.co/D43I96SlVu,12,10,gus,pupper,https://pbs.twimg.com/media/DEAz_HHXsAA-p_z.jpg,Labrador_retriever,5134,28903
882627270321602560,Twitter for iPhone,This is Stanley. He has his first swim lesson today. Doggle straps adjusted. Ready to go. 13/10 Phelps is nervous (IG: stanleythe_corgi) https://t.co/Nx52PGwH94,13,10,stanley,,https://pbs.twimg.com/media/DD-40X3WAAAJPU5.jpg,Pembroke,6342,28382
882268110199369728,Twitter for iPhone,This is Alfy. You're witnessing his first watermelon experience. I think it was a success. 13/10 happy 4th Alfy ðŸ‡ºðŸ‡¸ https://t.co/fYP5RlutfA,13,10,alfy,,https://pbs.twimg.com/media/DD5yKdPW0AArzX8.jpg,golden_retriever,12118,45880
881906580714921986,Twitter for iPhone,This is Rey. He's a Benebop Cumberfloof. 12/10 dangerously pettable https://t.co/503CgWbhxQ,12,10,rey,,https://pbs.twimg.com/media/DD0pWm9XcAAeSBL.jpg,Weimaraner,3533,24773
881666595344535552,Twitter for iPhone,This is Gary. He couldn't miss this puppertunity for a selfie. Flawless focusing skills. 13/10 would boop intensely https://t.co/7CSWCl8I6s,13,10,gary,,https://pbs.twimg.com/media/DDxPFwbWAAEbVVR.jpg,Saluki,11099,51522
881536004380872706,Twitter for iPhone,"Here is a pupper approaching maximum borkdrive. Zooming at never before seen speeds. 14/10 paw-inspiring af 
(IG: puffie_the_chow) https://t.co/ghXBIIeQZF",14,10,,pupper,https://pbs.twimg.com/ext_tw_video_thumb/881535971568889856/pu/img/9bawiZ--8FKywTkz.jpg,Samoyed,16570,50199
880872448815771648,Twitter for iPhone,Ugh not again. We only rate dogs. Please don't send in well-dressed  floppy-tongued street penguins. Dogs only please. Thank you... 12/10 https://t.co/WiAMbTkDPf,12,10,,,https://pbs.twimg.com/media/DDl8zzJW0AAisCJ.jpg,Pembroke,3989,21734
880465832366813184,Twitter for iPhone,This is Bella. She had her first beach experience this morning. Complete success. 12/10 would perform a sandy boop https://t.co/4VsFysDmiw,12,10,bella,,https://pbs.twimg.com/media/DDgK-J4XUAIEV9W.jpg,golden_retriever,6546,29075
880221127280381952,Twitter for iPhone,Meet Jesse. He's a Fetty Woof. His tongue ejects without warning. A true bleptomaniac. 12/10 would snug well https://t.co/fUod0tVmvK,12,10,jesse,,https://pbs.twimg.com/media/DDcscbXU0AIfDzs.jpg,Chihuahua,4436,27640
880095782870896641,Twitter for iPhone,Please don't send in photos without dogs in them. We're not @porch_rates. Insubordinate and churlish. Pretty good porch tho 11/10 https://t.co/HauE8M3Bu4,11,10,,,https://pbs.twimg.com/media/DDa6ckbXgAAM1vV.jpg,miniature_pinscher,4533,28150
879862464715927552,Twitter for iPhone,This is Romeo. He would like to do an entrance. Requesting your immediate assistance. 13/10 https://t.co/Qh5aEkRQm9,13,10,romeo,,https://pbs.twimg.com/media/DDXmPrbWAAEKMvy.jpg,basset,3642,22667
879492040517615616,Twitter for iPhone,This is Bailey. He thinks you should measure ear length for signs of growth instead. 12/10 https://t.co/IxM9IMKQq8,12,10,bailey,,https://pbs.twimg.com/media/DDSVWMvXsAEgmMK.jpg,German_short-haired_pointer,3323,23822
879415818425184262,Twitter for iPhone,This is Duddles. He did an attempt. 13/10 someone help him (vid by Georgia Felici) https://t.co/UDT7ZkcTgY,13,10,duddles,,https://pbs.twimg.com/ext_tw_video_thumb/879415784908390401/pu/img/cX7XI1TnUsseGET5.jpg,English_springer,45849,107956
879008229531029506,Twitter for iPhone,This is Beau. That is Beau's balloon. He takes it everywhere. 13/10 would protect at all costs https://t.co/YDtpCjIPKN,13,10,beau,,https://pbs.twimg.com/media/DDLdUrqXYAMOVzY.jpg,vizsla,2812,19317
878776093423087618,Twitter for iPhone,This is Snoopy. He's a proud #PrideMonthPuppo. Impeccable handwriting for not having thumbs. 13/10 would love back #PrideMonth https://t.co/lNZwgNO4gS,13,10,snoopy,puppo,https://pbs.twimg.com/media/DDIKMXzW0AEibje.jpg,Italian_greyhound,4319,19763
878281511006478336,Twitter for iPhone,"Meet Shadow. In an attempt to reach maximum zooming borkdrive, he tore his ACL. Still 13/10 tho. Help him out below

https://t.co/245xJJElsY https://t.co/lUiQH219v6",13,10,shadow,,https://pbs.twimg.com/media/DDBIX9QVYAAohGa.jpg,basset,1349,7913
878057613040115712,Twitter for iPhone,This is Emmy. She was adopted today. Massive round of pupplause for Emmy and her new family. 14/10 for all involved https://t.co/cwtWnHMVpe,14,10,emmy,,https://pbs.twimg.com/media/DC98vABUIAA97pz.jpg,French_bulldog,7181,42876
877736472329191424,Twitter for iPhone,This is Aja. She was just told she's a good dog. Suspicions confirmed. 13/10 would tell again https://t.co/lsPyyAiF1r,13,10,aja,,https://pbs.twimg.com/media/DC5YqoQW0AArOLH.jpg,Chesapeake_Bay_retriever,17300,71144
877556246731214848,Twitter for iPhone,This is Penny. She's both pupset and fired pup. Not pleased w your barbaric attempts at cleanliness. 12/10 would enjoy more shampoo options https://t.co/OYdDlfOGXP,12,10,penny,,https://pbs.twimg.com/media/DC20wEcW0AAf59m.jpg,basset,3994,23258
877316821321428993,Twitter for iPhone,"Meet Dante. At first he wasn't a fan of his new raincoat, then he saw his reflection. H*ckin handsome. 13/10 for water resistant good boy https://t.co/SHRTIo5pxc",13,10,dante,,https://pbs.twimg.com/media/DCza_vtXkAQXGpC.jpg,Saluki,5414,27907
877201837425926144,Twitter for iPhone,This is Nelly. He graduated with his dogtorate today. Wants to know if you're proud of him. 12/10 would give congratulatory boop https://t.co/4g4cfj3P4Y,12,10,nelly,,https://pbs.twimg.com/media/DCxyahJWsAAddSC.jpg,Pembroke,5880,27755
876838120628539392,Twitter for iPhone,This is Ginger. She's having a ruff Monday. Too many pupper things going on. H*ckin exhausting. 12/10 would snug passionately https://t.co/j211oCDRs6,12,10,ginger,pupper,https://pbs.twimg.com/media/DCsnnZsVwAEfkyi.jpg,bloodhound,3506,21125
876484053909872640,Twitter for iPhone,This is Benedict. He wants to thank you for this delightful urban walk. Hopes you know he loves you. 13/10 super duper good boy https://t.co/26BXueUgbs,13,10,benedict,,https://pbs.twimg.com/media/DCnll_dUQAAkBdG.jpg,golden_retriever,2511,19163
876120275196170240,Twitter for iPhone,"Meet Venti, a seemingly caffeinated puppoccino. She was just informed the weekend would include walks, pats and scritches. 13/10 much excite https://t.co/ejExJFq3ek",13,10,venti,,https://pbs.twimg.com/media/DCiavj_UwAAcXep.jpg,Bernese_mountain_dog,4903,28490
875747767867523072,Twitter for iPhone,"This is Goose. He's a womanizer. Cheeky as h*ck, but also deep. Tongue slip game on another level. 13/10 will steal your girl https://t.co/V2WlACRJCN",13,10,goose,,https://pbs.twimg.com/media/DCdH8YpUQAAiEbL.jpg,Labrador_retriever,4497,25773
875144289856114688,Twitter for iPhone,Meet Nugget and Hank. Nugget took Hank's bone. Hank is wondering if you would please return it to him. Both 13/10 would not intervene https://t.co/ogith9ejNj,13,10,nugget,,https://pbs.twimg.com/ext_tw_video_thumb/875144175078957056/pu/img/BRi_l7vUdpb93Knf.jpg,Siberian_husky,5081,22185
875021211251597312,Twitter for iPhone,Guys please stop sending pictures without any dogs in th- oh never mind hello excuse me sir. 12/10 stealthy as h*ck https://t.co/brCQoqc8AW,12,10,,,https://pbs.twimg.com/media/DCSzF3NVoAAPzT4.jpg,West_Highland_white_terrier,4922,26022
874680097055178752,Twitter for iPhone,Meet Cash. He hath acquired a stick. A very good stick tbh. 12/10 would pat head approvingly https://t.co/lZhtizkURD,12,10,cash,,https://pbs.twimg.com/media/DCN85nGUwAAzG_q.jpg,Labrador_retriever,4875,28439
874296783580663808,Twitter for iPhone,This is Jed. He may be the fanciest pupper in the game right now. Knows it too. 13/10 would sign modeling contract https://t.co/0YplNnSMEm,13,10,jed,pupper,https://pbs.twimg.com/media/DCIgSR0XgAANEOY.jpg,cocker_spaniel,4308,26651
874057562936811520,Twitter for iPhone,"I can't believe this keeps happening. This, is a birb taking a bath. We only rate dogs. Please only send dogs. Thank you... 12/10 https://t.co/pwY9PQhtP2",12,10,,,https://pbs.twimg.com/media/DCFGtdoXkAEsqIw.jpg,flat-coated_retriever,4125,23134
874012996292530176,Twitter for iPhone,"This is Sebastian. He can't see all the colors of the rainbow, but he can see that this flag makes his human happy. 13/10 #PrideMonth puppo https://t.co/XBE0evJZ6V",13,10,sebastian,puppo,https://pbs.twimg.com/media/DCEeLxjXsAAvNSM.jpg,Cardigan,11007,35501
873580283840344065,Twitter for iPhone,"We usually don't rate Deck-bound Saskatoon Black Bears, but this one is h*ckin flawless. Sneaky tongue slip too. 13/10 would hug firmly https://t.co/mNuMH9400n",13,10,,,https://pbs.twimg.com/media/DB-UotKXkAEHXVi.jpg,Newfoundland,4143,24837
873213775632977920,Twitter for iPhone,"This is Sierra. She's one precious pupper. Absolute 12/10. Been in and out of ICU her whole life. Help Sierra below

https://t.co/Xp01EU3qyD https://t.co/V5lkvrGLdQ",12,10,sierra,pupper,https://pbs.twimg.com/media/DB5HTBGXUAE0TiK.jpg,vizsla,1667,7467
872967104147763200,Twitter for iPhone,Here's a very large dog. He has a date later. Politely asked this water person to check if his breath is bad. 12/10 good to go doggo https://t.co/EMYIdoblMR,12,10,,doggo,https://pbs.twimg.com/media/DB1m871XUAAw5vZ.jpg,Labrador_retriever,5669,28031
872820683541237760,Twitter for iPhone,"Here are my favorite #dogsatpollingstations 
Most voted for a more consistent walking schedule and to increase daily pats tenfold. All 13/10 https://t.co/17FVMl4VZ5",13,10,,,https://pbs.twimg.com/media/DBzhx0PWAAEhl0E.jpg,pug,3884,15029
872620804844003328,Twitter for iPhone,This is Monkey. She's supporting owners everywhere with her fancy #PrideMonth bandana. 13/10 love is love is love... https://t.co/lUcpnZDPz9,13,10,monkey,,https://pbs.twimg.com/media/DBwr_hzXkAEnZBW.jpg,cocker_spaniel,3911,21309
872486979161796608,Twitter for iPhone,We. Only. Rate. Dogs. Do not send in other things like this fluffy floor shark clearly ready to attack. Get it together guys... 12/10 https://t.co/BZHiKx3FpQ,12,10,,,https://pbs.twimg.com/media/DBuyRlTUwAAYhG9.jpg,Pembroke,9429,41606
872261713294495745,Twitter for iPhone,This is Harry. His ears are activated one at a time. Incredibly rare to witness in person. Very special moment here. 13/10 blessed as h*ck https://t.co/ejHvGDfWoa,13,10,harry,,https://pbs.twimg.com/media/DBrlZk2UQAAfAkd.jpg,Labrador_retriever,6649,35085
871879754684805121,Twitter for iPhone,Say hello to Lassie. She's celebrating #PrideMonth by being a splendid mix of astute and adorable. Proudly supupporting her owner. 13/10 https://t.co/uK6PNyeh9w,13,10,lassie,,https://pbs.twimg.com/media/DBmKAmBXUAE-pQ-.jpg,Shetland_sheepdog,11918,39090
871762521631449091,Twitter for iPhone,This is Rover. As part of pupper protocol he had to at least attempt to eat the plant. Confirmed not tasty. Needs peanut butter. 12/10 https://t.co/AiVljI6QCg,12,10,rover,pupper,https://pbs.twimg.com/media/DBkfY58XcAEdzZy.jpg,Labrador_retriever,3678,20787
871515927908634625,Twitter for iPhone,This is Napolean. He's a Raggedy East Nicaraguan Zoom Zoom. Runs on one leg. Built for deception. No eyes. Good with kids. 12/10 great doggo https://t.co/PR7B7w1rUw,12,10,napolean,doggo,https://pbs.twimg.com/media/DBg_HT9WAAEeIMM.jpg,komondor,3628,20730
871032628920680449,Twitter for iPhone,"This is Boomer. He's doing an advanced water takeoff. The opposite of Sully. Ears for control, mlem for style. 13/10 simply breathtaking https://t.co/noNpY2Laoo",13,10,boomer,,https://pbs.twimg.com/media/DBaHi3YXgAE6knM.jpg,kelpie,3999,23255
870656317836468226,Twitter for iPhone,"This is Cody. He zoomed too aggressively and tore his ACL. Happens to the best of us. Still 13/10

Help Cody here: https://t.co/4hxnDOt1CV https://t.co/42ryYRQ2Q4",13,10,cody,,https://pbs.twimg.com/media/DBUxSSTXsAA-Jn1.jpg,Pembroke,2817,12819
870374049280663552,Twitter for iPhone,This is Zoey. She really likes the planet. Would hate to see willful ignorance and the denial of fairly elemental science destroy it. 13/10 https://t.co/T1xlgaPujm,13,10,zoey,,https://pbs.twimg.com/media/DBQwlFCXkAACSkI.jpg,golden_retriever,27680,85011
870308999962521604,Twitter for iPhone,"This is Rumble, but he's not ready to. Would rather fall asleep in his bath bucket. 13/10 would attempt a boop without waking https://t.co/MVQCzrF1g9",13,10,rumble,,https://pbs.twimg.com/media/DBP1asiUAAEKZI5.jpg,Greater_Swiss_Mountain_dog,4384,22453
869772420881756160,Twitter for iPhone,"This is Dewey (pronounced ""covfefe""). He's having a good walk. Arguably the best walk. 13/10 would snug softly https://t.co/HciEaJkC4D",13,10,dewey,,https://pbs.twimg.com/media/DBINZcxXgAQ-R6P.jpg,Pembroke,10663,43710
869702957897576449,Twitter for iPhone,Meet Stanley. He likes road trips. Will shift for you. One ear more effective than other. 13/10 we don't leave until you buckle pup Stanley https://t.co/vmCu3PFCQq,13,10,stanley,,https://pbs.twimg.com/media/DBHOOfOXoAABKlU.jpg,Pembroke,6728,29116
869596645499047938,Twitter for iPhone,This is Scout. He just graduated. Officially a doggo now. Have fun with taxes and losing sight of your ambitions. 12/10 would throw cap for https://t.co/DsA2hwXAJo,12,10,scout,doggo,https://pbs.twimg.com/media/DBFtiYqWAAAsjj1.jpg,Chihuahua,3327,16476
869227993411051520,Twitter for iPhone,This is Gizmo. His favorite thing is standing pupright like a hooman. Sneaky tongue slip status achieved. 13/10 would boop well https://t.co/IoR3n1fiiQ,13,10,gizmo,,https://pbs.twimg.com/media/DBAePiVXcAAqHSR.jpg,Pembroke,4023,21112
868622495443632128,Twitter for iPhone,Here's a h*ckin peaceful boy. Unbothered by the comings and goings. 13/10 please reveal your wise ways https://t.co/yeaH8Ej5eM,13,10,,,https://pbs.twimg.com/media/DA33i0XXsAEQtCA.jpg,Labrador_retriever,6275,28295
868552278524837888,Twitter for iPhone,"Say hello to Cooper. His expression is the same wet or dry. Absolute 12/10 but Coop desperately requests your help

https://t.co/ZMTE4Mr69f https://t.co/7RyeXTYLNi",12,10,cooper,,https://pbs.twimg.com/media/DA23sCeVoAE3uF0.jpg,whippet,2240,10539
867900495410671616,Twitter for iPhone,"Unbelievable. We only rate dogs. Please don't send in non-canines like the ""I"" from Pixar's opening credits. Thank you... 12/10 https://t.co/JMhDNv5wXZ",12,10,,,https://pbs.twimg.com/media/DAtm5MkXoAA4R6P.jpg,Labrador_retriever,4439,24964
867774946302451713,Twitter for iPhone,Meet Harold.  He's h*ckin cooperative. 13/10 good work Harold https://t.co/ZYg3NZGICa,13,10,harold,,https://pbs.twimg.com/media/DAr0tDZXUAEMvdu.jpg,Border_collie,7788,35179
867421006826221569,Twitter for iPhone,This is Shikha. She just watched you drop a skittle on the ground and still eat it. Could not be less impressed. 12/10 superior puppo https://t.co/XZlZKd73go,12,10,shikha,puppo,https://pbs.twimg.com/media/DAmyy8FXYAIH8Ty.jpg,Eskimo_dog,2697,16755
867051520902168576,Twitter for iPhone,"Oh my this spooked me up. We only rate dogs, not happy ghosts. Please send dogs only. It's a very simple premise. Thank you... 13/10 https://t.co/M5Rz0R8SIQ",13,10,,,https://pbs.twimg.com/media/DAhiwb0XcAA8x5Q.jpg,Samoyed,8425,33420
