tweet_id,source,text,rating_numerator,rating_denominator,dog_name,dog_class,jpg_url,dog_breed,retweet_count,favorite_count
722613351520608256,Twitter for iPhone,Meet Schnitzel. He's a Tropicana Floofboop. Getting too big for his favorite basket. 12/10 just so damn fluffy https://t.co/qjd0UJKYUY,12,10,schnitzel,,https://pbs.twimg.com/media/Cgc9AjMVIAERdUA.jpg,Labrador_retriever,1831,5393
721503162398597120,Twitter for iPhone,This is Panda. He's happy af. 11/10 https://t.co/IOAk9i4UvE,11,10,panda,,https://pbs.twimg.com/media/CgNLS1PW8AAxWSN.jpg,Pomeranian,2124,5086
721001180231503872,Twitter for iPhone,This is Oliver. Bath time is upon him. His fear of the wetness postpones his ultimate pupper destiny. 11/10 https://t.co/AFzzKqR4tT,11,10,oliver,pupper,https://pbs.twimg.com/media/CgGCvxAUkAAx55r.jpg,Samoyed,686,2748
720785406564900865,Twitter for iPhone,This is Archie. He hears everything you say. Doesn't matter where you are. 12/10 https://t.co/0l4I8famYp,12,10,archie,,https://pbs.twimg.com/media/CgC-gMCWcAAawUE.jpg,Chihuahua,866,3400
720775346191278080,Twitter for iPhone,This is Berkeley. He's in a predicament. 10/10 someone help him https://t.co/XSEXdQupej,10,10,berkeley,,https://pbs.twimg.com/media/CgC1WqMW4AI1_N0.jpg,Newfoundland,760,2702
720415127506415616,Twitter for iPhone,Garden's coming in nice this year. 10/10 https://t.co/5Lra3e4rrw,10,10,,,https://pbs.twimg.com/media/Cf9tuHUWsAAHSrV.jpg,Rottweiler,1681,4503
720389942216527872,Twitter for iPhone,This is RalphÃ©. He patrols the lake. Looking for babes. 11/10 https://t.co/Pb6iMmo0wk,11,10,ralphÃ©,,https://pbs.twimg.com/media/Cf9W1J-UMAErahM.jpg,Pembroke,2840,6974
720059472081784833,Twitter for iPhone,This is Charleson. He lost his plunger. Looked everywhere. Can't find it. So sad. 9/10 would comfort https://t.co/pRHX8yn9Yu,9,10,charleson,,https://pbs.twimg.com/media/Cf4qRcmWEAA9V4h.jpg,Mexican_hairless,1268,4229
720043174954147842,Twitter for iPhone,This is Neptune. He's a Snowy Swiss Mountain Floofapolis. Cheeky wink. Tongue nifty af. 11/10 would pet so firmly https://t.co/SoZq2Xoopv,11,10,neptune,,https://pbs.twimg.com/media/Cf4bcm8XEAAX4xV.jpg,Samoyed,2253,5332
719991154352222208,Twitter for iPhone,This doggo was initially thrilled when she saw the happy cartoon pup but quickly realized she'd been deceived. 10/10 https://t.co/mvnBGaWULV,10,10,,doggo,https://pbs.twimg.com/media/Cf3sH62VAAA-LiP.jpg,golden_retriever,1979,5281
719551379208073216,Twitter for iPhone,This is Harnold. He accidentally opened the front facing camera. 10/10 get it together Harnold https://t.co/S6JHaSMtln,10,10,harnold,,https://pbs.twimg.com/media/CfxcKU6W8AE-wEx.jpg,malamute,2192,5515
719339463458033665,Twitter for iPhone,Say hello to Lucy and Sophie. They think they're the same size. Both 10/10 would snug at same time https://t.co/HW50zkcf2R,10,10,lucy,,https://pbs.twimg.com/media/Cfuba6NW4AIeMHk.jpg,golden_retriever,1403,4822
719332531645071360,Twitter for iPhone,This is Pippa. She managed to start the car but is waiting for you to buckle up before driving. Responsible af 11/10 https://t.co/htrlmC7saz,11,10,pippa,,https://pbs.twimg.com/media/CfuVGl3WEAEKb16.jpg,Dandie_Dinmont,1078,3711
718971898235854848,Twitter for iPhone,This is Sadie. She is prepared for battle. 10/10 https://t.co/JRckDkZVRT,10,10,sadie,,https://pbs.twimg.com/media/CfpNGTHUIAAA8XC.jpg,golden_retriever,1231,3818
718939241951195136,Twitter for iPhone,This is Otis. Everybody look at Otis. 12/10 would probably faint while petting https://t.co/I9qoe1uEih,12,10,otis,,https://pbs.twimg.com/media/CfovbK4WIAAkTn3.jpg,Pembroke,1973,5720
718631497683582976,Twitter for iPhone,We normally don't rate marshmallows but this one appears to be flawlessly toasted so I'll make an exception. 10/10 https://t.co/D9jbbmPmos,10,10,,,https://pbs.twimg.com/media/CfkXiX6W4AAmICF.jpg,Pomeranian,9126,20697
718613305783398402,Twitter for iPhone,This is Carper. He's a Tortellini Angiosperm. In desperate need of a petting. 11/10 would hug softly https://t.co/lK9YDkRzPj,11,10,carper,,https://pbs.twimg.com/media/CfkG_PMWsAAH0MZ.jpg,Labrador_retriever,542,2669
718540630683709445,Twitter for iPhone,Get you a pup that can do both. 10/10 https://t.co/zSbyvm62xZ,10,10,,,https://pbs.twimg.com/media/CfjE5FRXEAErFWR.jpg,Maltese_dog,1137,2730
718246886998687744,Twitter for iPhone,This is Alexanderson. He's got a weird ass birth mark. Dreadful at fetch. Won't eat kibble. 3/10 wtf @Target https://t.co/FmxOpf2Sgl,3,10,alexanderson,,https://pbs.twimg.com/media/Cfe5tLWXEAIaoFO.jpg,Chihuahua,565,2115
718234618122661888,Twitter for iPhone,This is Suki. She was born with a blurry tail (unfortunate). Next level tongue tho. 11/10 nifty hardwood https://t.co/05S8oYztgb,11,10,suki,,https://pbs.twimg.com/media/CfeukpmW4AEGjOE.jpg,malamute,1127,4217
717841801130979328,Twitter for iPhone,This is Barclay. His father was a banana. 11/10 appeeling af https://t.co/ucOEfr2rjV,11,10,barclay,,https://pbs.twimg.com/media/CfZJTphWAAAl5Ys.jpg,Brittany_spaniel,670,2660
717537687239008257,Twitter for iPhone,People please. This is a Deadly Mediterranean Plop T-Rex. We only rate dogs. Only send in dogs. Thanks you... 11/10 https://t.co/2ATDsgHD4n,11,10,,,https://pbs.twimg.com/media/CfU0t75W4AAUo9V.jpg,golden_retriever,2069,6281
717421804990701568,Twitter for iPhone,This is Ebby. She's a Zimbabwean Feta. Embarrassed by ridiculously squishy face. 9/10 would squeeze softly https://t.co/LBJqxMGaHi,9,10,ebby,,https://pbs.twimg.com/media/CfTLUYWXEAEkyES.jpg,miniature_pinscher,945,3446
717047459982213120,Twitter for iPhone,This is FlÃ¡vio (pronounced Baxter). He's a Benesnoop Cumberdog. Super rare. Symmetrical. 12/10 would pet so well https://t.co/fGgleFiBPq,12,10,flÃ¡vio,,https://pbs.twimg.com/media/CfN23ArXEAEkZkz.jpg,golden_retriever,2135,6826
717009362452090881,Twitter for iPhone,This is Smokey. He's having some sort of existential crisis. 10/10 hang in there pupper https://t.co/JmgF4dMpw0,10,10,smokey,pupper,https://pbs.twimg.com/media/CfNUNetW8AAekHx.jpg,Siberian_husky,1102,3583
716802964044845056,Twitter for iPhone,This is Link. He struggles with couches. 10/10 would assist https://t.co/SbX4e6Yg3o,10,10,link,,https://pbs.twimg.com/media/CfKYfeBXIAAopp2.jpg,malinois,1317,4627
716791146589110272,Twitter for iPhone,Meet Jennifur. She's supposed to be navigating. Not even buckled up. Insubordinate &amp; churlish. 11/10 would still pet https://t.co/h0trcJohYO,11,10,jennifur,,https://pbs.twimg.com/media/CfKNvU8WsAAvI9Z.jpg,Pomeranian,1474,5204
716439118184652801,Twitter for iPhone,This is Bluebert. He just saw that both #FinalFur match ups are split 50/50. Amazed af. 11/10 https://t.co/Kky1DPG4iq,50,50,bluebert,,https://pbs.twimg.com/media/CfFNk7cWAAA-hND.jpg,Siberian_husky,247,2574
716285507865542656,Twitter for iPhone,This is Stephanus. She stays woke. 12/10 https://t.co/WIWabMngQZ,12,10,stephanus,,https://pbs.twimg.com/media/CfDB3aJXEAAEZNv.jpg,Yorkshire_terrier,1225,3041
716080869887381504,Twitter for iPhone,Here's a super majestic doggo and a sunset 11/10 https://t.co/UACnoyi8zu,11,10,,doggo,https://pbs.twimg.com/media/CfAHv83UMAIEQYx.jpg,golden_retriever,1935,5272
715928423106027520,Twitter for iPhone,This is Bubbles. He's a Yorkshire Piccolope. 11/10 would snug aggressively https://t.co/3BhMojONxq,11,10,bubbles,,https://pbs.twimg.com/media/Ce99GhLW8AAHG38.jpg,pug,987,3485
715733265223708672,Twitter for iPhone,This is a taco. We only rate dogs. Please only send in dogs. Dogs are what we rate. Not tacos. Thank you... 10/10 https://t.co/cxl6xGY8B9,10,10,,,https://pbs.twimg.com/media/Ce7LlUeUUAEQkQl.jpg,Dandie_Dinmont,1920,5093
715696743237730304,Twitter for iPhone,Meet Toby. He's a Lithuanian High-Steppin Stickeroo. One of the more accomplished Stickeroos around. 10/10 so nifty https://t.co/cYPHuJYTjC,10,10,toby,,https://pbs.twimg.com/media/Ce6qZC2WAAAcSoI.jpg,Staffordshire_bullterrier,1454,4257
715680795826982913,Twitter for iPhone,This is Zeus. He's downright fabulous. 12/10 https://t.co/sSugyyRuTp,12,10,zeus,,https://pbs.twimg.com/media/Ce6b4MPWwAA22Xm.jpg,golden_retriever,1813,4719
715342466308784130,Twitter for iPhone,This is Oscar. He's a world renowned snowball inspector. It's a ruff job but someone has to do it. 10/10 great guy https://t.co/vSufMAKm3C,10,10,oscar,,https://pbs.twimg.com/media/Ce1oLNqWAAE34w7.jpg,West_Highland_white_terrier,768,3294
715220193576927233,Twitter for iPhone,This is Nico. His selfie game is strong af. Excellent use of a sneaky tongue slip. 10/10 star material https://t.co/1OBdJkMOFx,10,10,nico,,https://pbs.twimg.com/media/Cez49UqWsAIRQXc.jpg,Chihuahua,736,2630
715200624753819648,Twitter for iPhone,This is Michelangelope. He's half coffee cup. Rare af. 12/10 would hug until someone stopped me https://t.co/tvVDY0G911,12,10,michelangelope,,https://pbs.twimg.com/media/CeznK6IWEAEFUPq.jpg,Chihuahua,2110,5578
714982300363173890,Twitter for iPhone,This is Calbert. He forgot to clear his Google search history. 9/10 rookie mistake Calbert https://t.co/jRm5J3YCmj,9,10,calbert,,https://pbs.twimg.com/media/CewgnHAXEAAdbld.jpg,Brittany_spaniel,1166,4094
714957620017307648,Twitter for iPhone,This is Curtis. He's an Albino Haberdasher. Terrified of dandelions. They really spook him up. 10/10 it'll be ok pup https://t.co/s8YcfZrWhK,10,10,curtis,,https://pbs.twimg.com/media/CewKKiOWwAIe3pR.jpg,Great_Pyrenees,1595,4503
714606013974974464,Twitter for iPhone,Here are two lil cuddly puppers. Both 12/10 would snug like so much https://t.co/zO4eb7C4tG,12,10,,,https://pbs.twimg.com/media/CerKYG8WAAM1aE-.jpg,Norfolk_terrier,1038,3938
714258258790387713,Twitter for iPhone,"Meet Travis and Flurp. Travis is pretty chill but Flurp can't lie down properly. 10/10 &amp; 8/10
get it together Flurp https://t.co/Akzl5ynMmE",10,10,travis,,https://pbs.twimg.com/media/CemOGNjWQAEoN7R.jpg,collie,808,3281
714251586676113411,Twitter for iPhone,This is Thumas. He hates potted plants. 8/10 wtf Thumas https://t.co/rDVueNIcEi,8,10,thumas,,https://pbs.twimg.com/media/CemIBt4WwAQqhVV.jpg,soft-coated_wheaten_terrier,940,3570
714214115368108032,Twitter for iPhone,Happy Easter from the squad! ðŸ‡ðŸ¶ 13/10 for all https://t.co/YMx4KWJUAB,13,10,,,https://pbs.twimg.com/media/Cell8ikWIAACCJ-.jpg,pug,990,2480
714141408463036416,Twitter for iPhone,"I know we only rate dogs, but since it's Easter I guess we could rate a bunny for a change. 10/10 petable as hell https://t.co/O2RlKXigHu",10,10,,,https://pbs.twimg.com/media/Cekj0qwXEAAHcS6.jpg,Labrador_retriever,1569,4673
713919462244790272,Twitter for iPhone,This is Kanu. He's a Freckled Ticonderoga. Simply flawless. 12/10 would perform an elaborate heist to capture https://t.co/7vyAzIURrE,12,10,kanu,,https://pbs.twimg.com/media/CehZ9mLWsAAsn28.jpg,Siberian_husky,869,3564
713900603437621249,Twitter for iPhone,Happy Saturday here's 9 puppers on a bench. 99/90 good work everybody https://t.co/mpvaVxKmc1,99,90,,,https://pbs.twimg.com/media/CehIzzZWQAEyHH5.jpg,golden_retriever,829,3062
713761197720473600,Twitter for iPhone,This is Piper. She would really like that tennis ball core. Super sneaky tongue slip. 12/10 precious af https://t.co/QP6GHi5az9,12,10,piper,,https://pbs.twimg.com/media/CefKBOuWIAAIlKD.jpg,Brittany_spaniel,1541,5308
713411074226274305,Twitter for iPhone,Here we see an extremely rare Bearded Floofmallow. Only a few left in the wild. 11/10 would pet with a purpose https://t.co/jVJJKlPbvq,11,10,,,https://pbs.twimg.com/media/CeaLlAPUMAIcC7U.jpg,Great_Pyrenees,1440,4802
713177543487135744,Twitter for iPhone,This is Lance. Lance doesn't give a shit. 10/10 we should all be more like Lance https://t.co/SqnG9Ap28J,10,10,lance,,https://pbs.twimg.com/media/CeW3MWMWQAEOMbq.jpg,whippet,3183,7854
712809025985978368,Twitter for iPhone,This is Stubert. He just arrived. 10/10 https://t.co/HVGs5aAKAn,10,10,stubert,,https://pbs.twimg.com/media/CeRoBaxWEAABi0X.jpg,Labrador_retriever,7602,20378
712717840512598017,Twitter for iPhone,Please don't send in any more polar bears. We only rate dogs. Thank you... 10/10 https://t.co/83RGhdIQz2,10,10,,,https://pbs.twimg.com/media/CeQVF1eVIAAJaTv.jpg,Great_Pyrenees,5616,13474
712668654853337088,Twitter for iPhone,Say hello to Sunny and Roxy. They pull things out of water together. 10/10 for both https://t.co/88aedAmxcl,10,10,sunny,,https://pbs.twimg.com/media/CePoVTyWsAQEz1g.jpg,Labrador_retriever,1367,4531
712097430750289920,Twitter for iPhone,I can't even comprehend how confused this dog must be right now. 10/10 https://t.co/8AGcQ4hIfK,10,10,,,https://pbs.twimg.com/media/CeHg1klW8AE4YOB.jpg,Labrador_retriever,1172,4144
712085617388212225,Twitter for iPhone,"Say hello to Olive and Ruby. They are best buddies. Both 11/10 
1 like = 1 buddy https://t.co/yagmFdKlyL",11,10,olive,,https://pbs.twimg.com/media/CeHWFksXIAAyypp.jpg,Shih-Tzu,556,3531
711743778164514816,Twitter for iPhone,Meet Roosevelt. He's calculating the best case scenario if he drops out instead of doing math hw. 11/10 relatable af https://t.co/QcSIRDpfVg,11,10,roosevelt,,https://pbs.twimg.com/media/CeCfMPDW0AAAEUj.jpg,Lakeland_terrier,1101,3095
711363825979756544,Twitter for iPhone,"""Please, no puparazzi"" 11/10 https://t.co/nJIXSPfedK",11,10,,,https://pbs.twimg.com/media/Cd9Fn5QUMAAYMT4.jpg,Pembroke,1287,3996
711008018775851008,Twitter for iPhone,This is Chuckles. He had a balloon but he accidentally let go of it and it floated away. 11/10 hang in there pupper https://t.co/68iNM7B5gW,11,10,chuckles,pupper,https://pbs.twimg.com/media/Cd4CBQFW8AAY3ND.jpg,French_bulldog,710,3275
710997087345876993,Twitter for iPhone,Meet Milo and Amos. They are the best of pals. Both 12/10 would pet at the same time https://t.co/Mv37BHEyyD,12,10,milo,,https://pbs.twimg.com/media/Cd34FClUMAAnvGP.jpg,malamute,1561,4960
710833117892898816,Twitter for iPhone,Say hello to Sora. She's an Egyptian Pumpernickel. Mesmerizing af. 12/10 would bring home to mom https://t.co/PmTR4kxZkq,12,10,sora,,https://pbs.twimg.com/media/Cd1i8qvUkAE-Jlr.jpg,Pembroke,606,2937
710658690886586372,Twitter for iPhone,Here's a brigade of puppers. All look very prepared for whatever happens next. 80/80 https://t.co/0eb7R1Om12,80,80,,,https://pbs.twimg.com/media/CdzETn4W4AAVU5N.jpg,soft-coated_wheaten_terrier,636,2529
710588934686908417,Twitter for iPhone,This is Beemo. He's a Chubberflop mix. 12/10 would cross the world for https://t.co/kzMVMU8HBV,12,10,beemo,,https://pbs.twimg.com/media/CdyE2x1W8AAe0TG.jpg,Pembroke,2107,4968
710283270106132480,Twitter for iPhone,This is Gunner. He's a Figamus Newton. King of the peek-a-boo. Cool jeans. 11/10 https://t.co/ONuBILIYXZ,11,10,gunner,,https://pbs.twimg.com/media/Cdtu3WRUkAAsRVx.jpg,Shih-Tzu,580,2308
710272297844797440,Twitter for iPhone,We ðŸ‘ðŸ» only ðŸ‘ðŸ» rate ðŸ‘ðŸ» dogs. Pls stop sending in non-canines like this Dutch Panda Worm. This is infuriating. 11/10 https://t.co/odfLzBonG2,11,10,,,https://pbs.twimg.com/media/Cdtk414WoAIUG0v.jpg,Old_English_sheepdog,1425,4945
710269109699739648,Twitter for iPhone,"The squad is back for St. Patrick's Day! â˜˜ ðŸ’š
13/10 for all https://t.co/OcCDb2bng5",13,10,,,https://pbs.twimg.com/media/Cdth_KyWEAEXH3u.jpg,pug,1257,2613
710140971284037632,Twitter for iPhone,This is Tater. His underbite is fierce af. Doesn't give a damn about your engagement photo. 8/10 https://t.co/nLuPY3pY12,8,10,tater,,https://pbs.twimg.com/media/Cdrtcr-W4AAqi5H.jpg,Pekinese,1008,3017
710117014656950272,Twitter for iPhone,This pupper got her hair chalked for her birthday. Hasn't told her parents yet. Rebellious af. 11/10 very nifty https://t.co/h1OX2mLtxV,11,10,,pupper,https://pbs.twimg.com/media/CdrXp9dWoAAcRfn.jpg,toy_poodle,2233,5999
709918798883774466,Twitter for iPhone,Meet Watson. He's a Suzuki Tickleboop. Leader of a notorious biker gang. Only one ear functional. 12/10 snuggable af https://t.co/R1gLc5vDqG,12,10,watson,,https://pbs.twimg.com/media/CdojYQmW8AApv4h.jpg,Pembroke,1215,3250
709852847387627521,Twitter for iPhone,*lets out a tiny whimper and then collapses* ...12/10 https://t.co/BNdVZEHRow,12,10,,,https://pbs.twimg.com/media/CdnnZhhWAAEAoUc.jpg,Chihuahua,1336,3824
709566166965075968,Twitter for iPhone,This is Olaf. He's gotta be rare. Seems sturdy. Tail is floofy af. 12/10 would do whatever it takes to pet https://t.co/E9jaU59bh9,12,10,olaf,,https://pbs.twimg.com/media/Cdjiqi6XIAIUOg-.jpg,chow,1367,3865
709556954897764353,Twitter for iPhone,This is Cecil. She's a Gigglefloof Poofer. Outdoorsy af. One with nature. 12/10 would strategically capture https://t.co/ijJB0DuOIC,12,10,cecil,,https://pbs.twimg.com/media/CdjaSFCWAAAJZh3.jpg,golden_retriever,1204,3593
709519240576036864,Twitter for iPhone,This is Vince. He's a Gregorian Flapjeck. White spot on legs almost looks like another dog (whoa). 9/10 rad as hell https://t.co/aczGAV2dK4,9,10,vince,,https://pbs.twimg.com/media/Cdi3-f7W8AUOm9T.jpg,cocker_spaniel,277,1620
709449600415961088,Twitter for iPhone,Meet Karma. She's just a head. Lost body during the Second Punic War (unfortunate). Loves to travel 10/10 petable af https://t.co/c6af6nYEPo,10,10,karma,,https://pbs.twimg.com/media/Cdh4pgAW0AEKJ_a.jpg,Maltese_dog,665,2420
709409458133323776,Twitter for iPhone,This is Billy. He sensed a squirrel. 8/10 damn it Billy https://t.co/Yu0K98VZ9A,8,10,billy,,https://pbs.twimg.com/media/CdhUIMSUIAA4wYK.jpg,Shetland_sheepdog,788,2855
709225125749587968,Twitter for iPhone,This is Walker. He's a Butternut Khalifa. Appears fuzzy af. 11/10 would hug for a ridiculous amount of time https://t.co/k6fEWHSALn,11,10,walker,,https://pbs.twimg.com/media/Cdese-zWEAArIqE.jpg,Labrador_retriever,647,2615
709207347839836162,Twitter for iPhone,This is Penny. She's trying on her prom dress. Stunning af 11/10 https://t.co/qcZDZGCapg,11,10,penny,,https://pbs.twimg.com/media/CdecUSzUIAAHCvg.jpg,Chihuahua,6567,13755
709198395643068416,Twitter for iPhone,"From left to right:
Cletus, Jerome, Alejandro, Burp, &amp; Titson
None know where camera is. 45/50 would hug all at once https://t.co/sedre1ivTK",45,50,,,https://pbs.twimg.com/media/CdeUKpcWoAAJAWJ.jpg,borzoi,721,2634
709158332880297985,Twitter for iPhone,Meet Rodney. He's a Ukranian Boomchicka. Outside but would like to be inside. Only has one ear (unfortunate) 10/10 https://t.co/FjAj3ggXrR,10,10,rodney,,https://pbs.twimg.com/media/CddvvSwWoAUObQw.jpg,Siberian_husky,470,2236
708845821941387268,Twitter for iPhone,Here's a pupper with magic eyes. Not wearing a seat belt tho (irresponsible af). Very distracting to driver. 9/10 https://t.co/5DLJB4ssvI,9,10,,pupper,https://pbs.twimg.com/media/CdZTgynWwAATZcx.jpg,schipperke,1015,3226
708834316713893888,Twitter for iPhone,Meet Malikai. He was rolling around having fun when he remembered the inevitable heat death of the universe. 10/10 https://t.co/Vd2FqHIIGn,10,10,malikai,,https://pbs.twimg.com/media/CdZI_bpWEAAm1fs.jpg,Eskimo_dog,571,1860
708810915978854401,Twitter for iPhone,This is Mister. He's a wonderful father to his two pups. Heartwarming af. 10/10 for all https://t.co/2KcuJXL2r4,10,10,mister,,https://pbs.twimg.com/media/CdYzwuYUIAAHPkB.jpg,golden_retriever,7848,18036
708738143638450176,Twitter for iPhone,This is Coco. She gets to stay on the Bachelor for another week. Super pumped 11/10 https://t.co/wsCB6LFNxD,11,10,coco,,https://pbs.twimg.com/media/CdXxlFPWwAABaOv.jpg,Pomeranian,917,2997
708479650088034305,Twitter for iPhone,Meet Bear. He's a Beneboop Cumberclap. Extremely unamused. 13/10 I'm in love with this picture https://t.co/uC8kUqAz0W,13,10,bear,,https://pbs.twimg.com/media/CdUGcLMWAAI42q0.jpg,Shih-Tzu,765,2768
708469915515297792,Twitter for iPhone,This is Bobble. He's a Croatian Galifianakis. Hears everything within 400 miles. 11/10 would snug diligently https://t.co/VwDc6PTDzk,11,10,bobble,,https://pbs.twimg.com/media/CdT9n7mW0AQcpZU.jpg,Chihuahua,926,3357
708356463048204288,Twitter for iPhone,This is Oliver. That is his castle. He protects it with his life. He's also squishy af. 10/10 would squish softly https://t.co/oSuEGw0BhX,10,10,oliver,,https://pbs.twimg.com/media/CdSWcc1XIAAXc6H.jpg,pug,1520,3929
708149363256774660,Twitter for iPhone,This is Jebberson. He's the reigning hide and seek world champion. 10/10 hasn't lost his touch https://t.co/VEFkvWCoHF,10,10,jebberson,,https://pbs.twimg.com/media/CdPaEkHW8AA-Wom.jpg,Cardigan,1727,4672
708130923141795840,Twitter for iPhone,Please stop sending in non canines like this Guatemalan Twiggle Bunny. We only rate dogs. Only send in dogs... 11/10 https://t.co/XKhobeGuvT,11,10,,,https://pbs.twimg.com/media/CdPJUWIWIAAIchl.jpg,French_bulldog,943,3707
708119489313951744,Twitter for iPhone,This is Cooper. He basks in the glory of rebellion. 9/10 probably a preteen https://t.co/kDamUfeIpm,9,10,cooper,,https://pbs.twimg.com/media/CdO-6x5W8AENSBJ.jpg,Norwich_terrier,1102,2937
708109389455101952,Twitter for iPhone,This is Remington. He was caught off guard by the magical floating cheese. Spooked af. 10/10 deep breaths pup https://t.co/mhPSADiJmZ,10,10,remington,,https://pbs.twimg.com/media/CdO1u9vWAAApj2V.jpg,Staffordshire_bullterrier,610,2124
708026248782585858,Twitter for iPhone,Everybody stop what you're doing and watch this video. Frank is stuck in a loop. 13/10 (Vid by @klbmatty) https://t.co/5AJs8TIV1U,13,10,,,https://pbs.twimg.com/ext_tw_video_thumb/708026062568087553/pu/img/rNhylAwIfb6YthGu.jpg,malinois,2166,4799
707969809498152960,Twitter for iPhone,Meet Rufus. He's a Honeysuckle Firefox. Curly af. Badass tie. About to go on his first date ever 11/10 good luck pup https://t.co/dGoTWNfIsm,11,10,rufus,,https://pbs.twimg.com/media/CdM2xRpXEAUsR4k.jpg,toy_poodle,1097,2941
707776935007539200,Twitter for iPhone,This is Sadie. She's a Bohemian Rhapsody. Remarkably portable. Could sneak on roller coasters with (probably). 11/10 https://t.co/DB8fyeDs8B,11,10,sadie,,https://pbs.twimg.com/media/CdKHWimWoAABs08.jpg,miniature_pinscher,1079,3593
707741517457260545,Twitter for iPhone,When your roommate eats your leftover Chili's but you pretend it's no big deal cuz you fat anyway. 10/10 head up pup https://t.co/0nMgoue8IR,10,10,,,https://pbs.twimg.com/media/CdJnJ1dUEAARNcf.jpg,whippet,696,2718
707610948723478529,Twitter for iPhone,This is Harper. She scraped her elbow attempting a backflip off a tree. Valiant effort tho. 12/10 https://t.co/oHKJHghrp5,12,10,harper,,https://pbs.twimg.com/media/CdHwZd0VIAA4792.jpg,golden_retriever,7236,18557
707411934438625280,Twitter for iPhone,"""I shall trip the big pupper with leash. Big pupper will never see it coming. I am a genius."" Both 11/10 https://t.co/uQsCJ8pf51",11,10,,pupper,https://pbs.twimg.com/media/CdE7ZktXIAEiWLj.jpg,Lakeland_terrier,673,2486
707387676719185920,Twitter for iPhone,Meet Clarkus. He's a Skinny Eastern Worcestershire. Can tie own shoes (impressive af) 10/10 would put on track team https://t.co/XP5o7zGn0E,10,10,clarkus,,https://pbs.twimg.com/media/CdElVm7XEAADP6o.jpg,Chihuahua,1490,3835
707377100785885184,Twitter for iPhone,This dog just brutally murdered a snowman. Currently toying with its nutritious remains 9/10 would totally still pet https://t.co/iKThgKnW1j,9,10,,,https://pbs.twimg.com/media/CdEbt0NXIAQH3Aa.jpg,golden_retriever,1214,3603
707315916783140866,Twitter for iPhone,This is Finnegus. He's trapped in a snow globe. Poor pupper. 10/10 would make sure no one shook it https://t.co/BjpOa52jQ4,10,10,finnegus,pupper,https://pbs.twimg.com/media/CdDkEkHWwAAAeUJ.jpg,Bernese_mountain_dog,727,2698
707297311098011648,Twitter for iPhone,This is Cassie. She can go from sweet to scary af in a matter of seconds. 10/10 points deducted for cats on pajamas https://t.co/B6dmZmJBdK,10,10,cassie,,https://pbs.twimg.com/media/CdDTJLMW4AEST--.jpg,Blenheim_spaniel,903,3022
707059547140169728,Twitter for iPhone,Say hello to Cupcake. She's an Icelandic Dippen Dot. Confused by the oddly geometric lawn pattern. 11/10 https://t.co/D7rorf4YKL,11,10,cupcake,,https://pbs.twimg.com/media/Cc_64zVWEAAeXs7.jpg,Samoyed,759,2796
707038192327901184,Twitter for iPhone,This is Kathmandu. He sees every move you make. Probably knows Jiu-Jitsu. 10/10 mysterious af https://t.co/z0cs7E4Xjj,10,10,kathmandu,,https://pbs.twimg.com/media/Cc_ney1W4AANuY3.jpg,pug,900,2404
707021089608753152,Twitter for iPhone,This is Tucker. He's a Dasani Episcopalian. Good lord what a tongue. 12/10 would never let go of https://t.co/gHtW5cgyy7,12,10,tucker,,https://pbs.twimg.com/media/Cc_XtkRW8AEE7Fn.jpg,cocker_spaniel,1540,4433
707014260413456384,Twitter for iPhone,This is Ellie. She requests to be carried around in a lacrosse stick at all times. 11/10 impossible to say no https://t.co/15yCmd43zU,11,10,ellie,,https://pbs.twimg.com/media/Cc_RsVlXEAIzzlX.jpg,Chihuahua,664,2502
706681918348251136,Twitter for iPhone,Say hello to Katie. She's a Mitsubishi Hufflepuff. Curly af. 12/10 I'd do terrible things to acquire such a pup https://t.co/CFPIcGcwJv,12,10,katie,,https://pbs.twimg.com/media/Cc6jcYRXIAAFuox.jpg,toy_poodle,1103,3627
706538006853918722,Twitter for iPhone,"This is Oliver (pronounced ""Ricardo""). He's a ship captain. Controls these treacherous waters. 11/10 would sail with https://t.co/bxjO45rXKd",11,10,oliver,,https://pbs.twimg.com/media/Cc4gjxqW4AIoThO.jpg,chow,1580,3778
706516534877929472,Twitter for iPhone,Please enjoy this pup in a cooler. Permanently ready for someone to throw a tennis ball his way. 12/10 https://t.co/KUS0xl7XIp,12,10,,,https://pbs.twimg.com/media/Cc4NCQiXEAEx2eJ.jpg,golden_retriever,1150,3404
706346369204748288,Twitter for iPhone,This is Koda. She's a Beneboom Cumberwiggle. 12/10 petable as hell https://t.co/VZV6oMJmU6,12,10,koda,,https://pbs.twimg.com/media/Cc1yRE2WoAAgxFQ.jpg,Tibetan_mastiff,1035,3768
706310011488698368,Twitter for iPhone,Here's a very sleepy pupper. Thinks it's an airplane. 12/10 would snug for eternity https://t.co/GGmcTIkBbf,12,10,,pupper,https://pbs.twimg.com/media/Cc1RNHLW4AACG6H.jpg,Pembroke,9034,23443
