tweet_id,source,text,rating_numerator,rating_denominator,dog_name,dog_class,jpg_url,dog_breed,retweet_count,favorite_count
683828599284170753,Twitter for iPhone,Breathtaking pupper here. Should be on the cover of Dogue. Top-notch tongue. Appears considerably fluffy. 12/10 https://t.co/Eeh3yfdglS,12,10,,pupper,https://pbs.twimg.com/media/CX1ye7HUMAADDzh.jpg,malamute,1195,3053
683773439333797890,Twitter for iPhone,This is Buddy. He's gaining strength. Currently an F4 tornado with wind speeds up to 260mph. Very devastating. 9/10 https://t.co/qipZbshNsR,9,10,buddy,,https://pbs.twimg.com/media/CX1AUQ2UAAAC6s-.jpg,miniature_pinscher,1533,3684
683742671509258241,Twitter for iPhone,Meet Sebastian. He's a womanizer. Romantic af. Always covered in flower petals. Also a poet. 11/10 dreamy as hell https://t.co/eoL1bCpWCg,11,10,sebastian,,https://pbs.twimg.com/media/CX0kVRxWYAAWWZi.jpg,Pembroke,3781,7162
683498322573824003,Twitter for iPhone,This is Griffin. He's desperate for both a physical and emotion connection. 11/10 I'd hug the hell out of Griffin https://t.co/ObWcOEekt0,11,10,griffin,,https://pbs.twimg.com/media/CXxGGOsUwAAr62n.jpg,Airedale,1095,3469
683481228088049664,Twitter for iPhone,Meet Banjo. He's a Peppercorn Shoop Da Whoop. Nails look lethal. Skeptical of luminescent orb 11/10 stay woke pupper https://t.co/H7NZFumpKq,11,10,banjo,pupper,https://pbs.twimg.com/media/CXw2jSpWMAAad6V.jpg,keeshond,1118,2878
683462770029932544,Twitter for iPhone,"""Hello forest pupper I am house pupper welcome to my abode"" (8/10 for both) https://t.co/qFD8217fUT",8,10,,pupper,https://pbs.twimg.com/media/CXwlw9MWsAAc-JB.jpg,Italian_greyhound,761,2676
683449695444799489,Twitter for iPhone,I just want to be friends with this dog. Appears to be into the sports. A true brobean. 10/10 would introduce to mom https://t.co/1Z7Q6svWpe,10,10,,,https://pbs.twimg.com/media/CXwZ3pbWsAAriTv.jpg,Lakeland_terrier,1837,4290
683391852557561860,Twitter for iPhone,"Say hello to Jack (pronounced ""Kevin""). He's a Virgo Episcopalian. Can summon rainbows. 11/10 magical as hell https://t.co/YHXrdUTHd6",11,10,jack,,https://pbs.twimg.com/media/CXvlQ2zW8AAE0tp.jpg,French_bulldog,2702,8356
683357973142474752,Twitter for iPhone,"""Have a seat, son. There are some things we need to discuss"" 10/10 https://t.co/g4G5tvfTVd",10,10,,,https://pbs.twimg.com/media/CXvGbWeWMAcRbyJ.jpg,Pembroke,1059,3238
683142553609318400,Twitter for iPhone,Meet Brandy. She's a member of the Bloods. Menacing criminal pupper. Soft spot for flowers tho. 9/10 pet w caution https://t.co/hhIA3coiAJ,9,10,brandy,pupper,https://pbs.twimg.com/media/CXsChyjW8AQJ16C.jpg,Leonberg,1173,3162
683111407806746624,Twitter for iPhone,This is Larry. He thought the New Year's parties were tonight. 10/10 poor pupper. Maybe next year https://t.co/h3X0jK8MVM,10,10,larry,pupper,https://pbs.twimg.com/media/CXrmMSpUwAAdeRj.jpg,cocker_spaniel,1034,3736
683098815881154561,Twitter for iPhone,aahhhhkslaldhwnxmzbbs 12/10 for being da smooshiest https://t.co/UOPdXmUz4H,12,10,,,https://pbs.twimg.com/media/CXrawAhWkAAWSxC.jpg,golden_retriever,736,2361
683030066213818368,Twitter for iPhone,This is Lulu. She's contemplating all her unreached 2015 goals and daydreaming of a more efficient tomorrow. 10/10 https://t.co/h3ScYuz77J,10,10,lulu,,https://pbs.twimg.com/media/CXqcOHCUQAAugTB.jpg,boxer,832,2370
682750546109968385,Twitter for iPhone,Meet Taco. He's a speckled Garnier Fructis. Loves to shadow box. Ears out of control. Friend clearly impressed 9/10 https://t.co/85X1GHohFr,9,10,taco,,https://pbs.twimg.com/media/CXmd_bsWkAEEXck.jpg,English_setter,494,1674
682662431982772225,Twitter for iPhone,Meet Joey and Izzy. Joey only has one ear that works and Izzy wants 2015 to be over already. Both great pups. 11/10s https://t.co/WgQTIQ93BB,11,10,joey,,https://pbs.twimg.com/media/CXlN1-EWMAQdwXK.jpg,beagle,1207,3326
682638830361513985,Twitter for iPhone,I have no words. Just a magnificent pup. 12/10 https://t.co/viwWHZgX8j,12,10,,,https://pbs.twimg.com/media/CXk4W0qWYAMEMEs.jpg,English_springer,675,2266
682429480204398592,Twitter for iPhone,"I know we joke around on here, but this is getting really frustrating. We rate dogs. Not T-Rex. Thank you... 8/10 https://t.co/5aFw7SWyxU",8,10,,,https://pbs.twimg.com/media/CXh5_dDWQAIbU-J.jpg,whippet,1320,3769
682393905736888321,Twitter for iPhone,This is Kreg. He's riding an invisible jet ski. 11/10 that's downright legendary https://t.co/BA5AV5dx6Y,11,10,kreg,,https://pbs.twimg.com/media/CXhZom1UwAA4Zz6.jpg,vizsla,773,2441
682389078323662849,Twitter for iPhone,"Meet Brody. He's a Downton Abbey Falsetto. Addicted to grating cheese. He says he can stop but we know he can't
9/10 https://t.co/vBeiQq6SaZ",9,10,brody,,https://pbs.twimg.com/media/CXhVKtvW8AAyiyK.jpg,curly-coated_retriever,518,1828
682259524040966145,Twitter for iPhone,Meet Jax. He's an Iglesias Hufflepoof. Quite the jokester. Takes it too far sometimes. Can be very hurtful. 9/10 https://t.co/i5TeG0KYcW,9,10,jax,,https://pbs.twimg.com/media/CXffar9WYAArfpw.jpg,Siberian_husky,1375,4578
682032003584274432,Twitter for iPhone,This is Ulysses. He likes holding hands and his eyes are magic. 11/10 https://t.co/gPmJHmtgak,11,10,ulysses,,https://pbs.twimg.com/media/CXcQfUNUQAEwFoQ.jpg,schipperke,2294,7223
681981167097122816,Twitter for iPhone,This is Jimothy. He's a Trinidad Poliwhirl. Father was a velociraptor. Exceptionally unamused. 12/10 would adopt https://t.co/VwdIk0OwVx,12,10,jimothy,,https://pbs.twimg.com/media/CXbiQHmWcAAt6Lm.jpg,Labrador_retriever,1161,3043
681891461017812993,Twitter for iPhone,Say hello to Charlie. He's scholarly af. Quite intimidating with all his pupper knowledge 10/10 even built that fire https://t.co/9KThv6z8u5,10,10,charlie,pupper,https://pbs.twimg.com/media/CXaQqGbWMAAKEgN.jpg,Chihuahua,951,2706
681694085539872773,Twitter for iPhone,This is Bo. He's a Benedoop Cumbersnatch. Seems frustrated with own feet. Portable as hell. 11/10 very solid pupper https://t.co/TONMhRoQh7,11,10,bo,pupper,https://pbs.twimg.com/media/CXXdJ7CVAAALu23.jpg,toy_poodle,4581,14010
681654059175129088,Twitter for iPhone,This is Toffee. He's a happy pupper. Appears dangerously fluffy. Extraordinarily spherical. 12/10 would pet firmly https://t.co/oEXEKt3MHu,12,10,toffee,pupper,https://pbs.twimg.com/media/CXW4wGHWsAE_eBD.jpg,Pomeranian,1045,2903
681610798867845120,Twitter for iPhone,*collapses* 12/10 https://t.co/C7M8mnzHIK,12,10,,,https://pbs.twimg.com/media/CXWRZBgWkAEHMea.jpg,toy_poodle,533,2100
681579835668455424,Twitter for iPhone,This is Apollo. He thought you weren't coming back so he had a mental breakdown. 8/10 we've all been there https://t.co/ojUBrDCHLT,8,10,apollo,,https://pbs.twimg.com/media/CXV1Ot_W8AEpkQO.jpg,Rottweiler,1489,3893
681523177663676416,Twitter for iPhone,This is Carly. She's actually 2 dogs fused together. Very innovative. Probably has superpowers. 12/10 for double dog https://t.co/GQn2IopLud,12,10,carly,,https://pbs.twimg.com/media/CXVBtX_WwAEuqbP.jpg,Norfolk_terrier,6620,15749
681320187870711809,Twitter for iPhone,This is Glacier. He's a very happy pup. Loves to sing in the sunlight. 11/10 https://t.co/jTBPqKgkz7,11,10,glacier,,https://pbs.twimg.com/media/CXSJGAQUQAAoG9Q.jpg,Samoyed,863,2918
681297372102656000,Twitter for iPhone,"This is actually a lion. We only rate dogs. For the last time please only send dogs. Thank u.
12/10 would still pet https://t.co/Pp26dMQxap",12,10,,,https://pbs.twimg.com/media/CXR0WJ_W8AMd_O8.jpg,Lhasa,1091,3490
681281657291280384,Twitter for iPhone,Meet Sarge. His parents signed him up for dancing lessons but his true passion is roller coasters 11/10 very petable https://t.co/KvVoBIgkje,11,10,sarge,,https://pbs.twimg.com/media/CXRmDfWWMAADCdc.jpg,Saint_Bernard,1258,3520
681261549936340994,Twitter for iPhone,Say hello to Panda. He's a Quackadilly Shooster. Not amused by your fake ball throwing motion. 9/10 would hug lots https://t.co/wL1iDvbcVk,9,10,panda,,https://pbs.twimg.com/media/CXRTw_5WMAAUDVp.jpg,Tibetan_terrier,308,1597
681231109724700672,Twitter for iPhone,I just love this pic. 11/10 this pupper is going places https://t.co/P16uhh1PbI,11,10,,pupper,https://pbs.twimg.com/media/CXQ4EwQWwAEVaUf.jpg,Irish_setter,540,2629
681193455364796417,Twitter for iPhone,This is Aspen. He's astronomically fluffy. I wouldn't stop petting this dog if the world was ending around me 11/10 https://t.co/oBlgL9nxpx,11,10,aspen,,https://pbs.twimg.com/media/CXQV03pWYAAVniz.jpg,Pomeranian,1691,4077
680970795137544192,Twitter for iPhone,I thought I made this very clear. We only rate dogs. Stop sending other things like this shark. Thank you... 9/10 https://t.co/CXSJZ4Stk3,9,10,,,https://pbs.twimg.com/media/CXNLU6wWkAE0OkJ.jpg,pug,749,2665
680940246314430465,Twitter for iPhone,This is Alice. She's an idiot. 4/10 https://t.co/VQXdwJfkyS,4,10,alice,,https://pbs.twimg.com/media/CXMvio7WQAAPZJj.jpg,soft-coated_wheaten_terrier,1225,3544
680934982542561280,Twitter for iPhone,Say hello to Sadie. She's a Tortellini Sidewinder. Very jubilant pup. Seems loyal. Leaves on point. 10/10 petable af https://t.co/g2bTu4ayPl,10,10,sadie,,https://pbs.twimg.com/media/CXMqwIQWcAA2iE0.jpg,Labrador_retriever,497,2285
680913438424612864,Twitter for iPhone,Meet Griswold. He's dapper as hell. Already pumped for next Christmas. 11/10 https://t.co/5NrpNDyFzN,11,10,griswold,,https://pbs.twimg.com/media/CXMXKKHUMAA1QN3.jpg,Pomeranian,705,2609
680889648562991104,Twitter for iPhone,This is Cheesy. It's her birthday. She's patiently waiting to eat her party muffin. 9/10 happy birthday pup https://t.co/cH2H7mch2H,9,10,cheesy,,https://pbs.twimg.com/media/CXMBhXfWEAA4mMI.jpg,Shetland_sheepdog,418,1945
680836378243002368,Twitter for iPhone,This is Ellie. She's secretly ferocious. 12/10 very deadly pupper https://t.co/BF4BW8LUgb,12,10,ellie,pupper,https://pbs.twimg.com/media/CXLREjOW8AElfk6.jpg,Pembroke,1513,3766
680801747103793152,Twitter for iPhone,Great picture here. Dog on the right panicked &amp; forgot about his tongue. Middle green dog must've fainted. All 10/10 https://t.co/31npKUAox0,10,10,,,https://pbs.twimg.com/media/CXKxkseW8AAjAMY.jpg,pug,925,2600
680609293079592961,Twitter for iPhone,This is Brody. That is his chair. He loves his chair. Never leaves it. 9/10 might be stuck actually https://t.co/WvJRg0XJit,9,10,brody,,https://pbs.twimg.com/media/CXICiB9UwAE1sKY.jpg,French_bulldog,816,2906
680497766108381184,Twitter for iPhone,Meet Percy. He's a Latvian Yuletide Heineken. Refuses to take off sweater. Kinda feisty. 12/10 would keep in pocket https://t.co/QGM5Fcuv7s,12,10,percy,,https://pbs.twimg.com/media/CXGdG0aWcAEbOO1.jpg,Chihuahua,2162,4639
680494726643068929,Twitter for iPhone,Here we have uncovered an entire battalion of holiday puppers. Average of 11.26/10 https://t.co/eNm2S6p9BD,26,10,,,https://pbs.twimg.com/media/CXGaVxOWAAADjhF.jpg,kuvasz,542,1879
680473011644985345,Twitter for iPhone,"This is Hector. He thinks he's a hammer. Silly Hector. You're a pupper, not a hammer. 10/10 https://t.co/OdUFuZIXiI",10,10,hector,pupper,https://pbs.twimg.com/media/CXGGlzvWYAArPfk.jpg,Lakeland_terrier,844,2778
680191257256136705,Twitter for iPhone,Here's a sleepy Christmas pupper 11/10 https://t.co/KXg0f8GNQ9,11,10,,pupper,https://pbs.twimg.com/media/CXCGVXyWsAAAVHE.jpg,Brittany_spaniel,577,2356
680161097740095489,Twitter for iPhone,Meet Goliath. He's an example of irony. Head is phenomenally round. Wants to be an ornament. 12/10 would hug gently https://t.co/72Dil0Aktw,12,10,goliath,,https://pbs.twimg.com/media/CXBq6RPWkAAaNuU.jpg,bluetick,828,2538
680145970311643136,Twitter for iPhone,Say hello to Kawhi. He was doing fine until his hat fell off. He got it back though. 10/10 deep breaths pupper https://t.co/N5pM6WBx7e,10,10,kawhi,pupper,https://pbs.twimg.com/media/CXBdJxLUsAAWql2.jpg,miniature_poodle,1972,3955
680130881361686529,Twitter for iPhone,This is Reggie. His Santa hat is a little big. 10/10 he's still having fun https://t.co/w0dcGXq7qK,10,10,reggie,,https://pbs.twimg.com/media/CXBPbVtWAAA2Vus.jpg,Maltese_dog,1078,2519
680115823365742593,Twitter for iPhone,This is Ozzy. He woke up 2 minutes before he had to be ready for the Christmas party. 9/10 classic Ozzy https://t.co/Kt9vmw0Fap,9,10,ozzy,,https://pbs.twimg.com/media/CXBBurSWMAELewi.jpg,pug,1028,2972
680100725817409536,TweetDeck,This pupper is not coming inside until she catches a snowflake on her tongue. 11/10 the determination is palpable https://t.co/lvMYbmKq8H,11,10,,pupper,https://pbs.twimg.com/media/CW-loUBWYAAn2Cb.jpg,golden_retriever,1554,3891
680055455951884288,TweetDeck,"Meet Sammy. At first I was like ""that's a snowflake. we only rate dogs,"" but he would've melted by now, so 10/10 https://t.co/MQfPK4zwuh",10,10,sammy,,https://pbs.twimg.com/media/CW-ZRC_WQAAyFrL.jpg,Samoyed,8067,18278
679862121895714818,Twitter for iPhone,"""Dammit hooman I'm jus trynna lik the fler"" 11/10 https://t.co/eRZRI8OTj7",11,10,,,https://pbs.twimg.com/media/CW9a_h1WwAApmAy.jpg,EntleBucher,706,2678
679844490799091713,Twitter for iPhone,This is Willie. He's floating away and needs your assistance. Please someone help Willie. 10/10 https://t.co/MJqygWqt8X,10,10,willie,,https://pbs.twimg.com/media/CW9K9VeVAAE0j-x.jpg,Airedale,887,2593
679828447187857408,Twitter for iPhone,Everybody look at this beautiful pupper 13/10 https://t.co/hyAC5Hq9GC,13,10,,pupper,https://pbs.twimg.com/media/CW88XN4WsAAlo8r.jpg,Chihuahua,15839,39726
679777920601223168,Twitter for iPhone,This is Rinna. She's melting. 10/10 get inside pupper https://t.co/PA0czwucsb,10,10,rinna,pupper,https://pbs.twimg.com/media/CW8OYajUMAAPRoF.jpg,bloodhound,1281,3390
679736210798047232,Twitter for iPhone,This pup's name is Sabertooth (parents must be cool). Ears for days. Jumps unannounced. 9/10 would pet diligently https://t.co/iazoiNUviP,9,10,,,https://pbs.twimg.com/media/CW7oelWWcAAhyzz.jpg,French_bulldog,918,2311
679722016581222400,Twitter for iPhone,This is Mike. He is a Jordanian Frito Pilates. Frowning because he can't see directly in front of him. 8/10 https://t.co/NL5QJwdEpF,8,10,mike,,https://pbs.twimg.com/media/CW7bkW6WQAAksgB.jpg,boxer,539,1817
679530280114372609,Twitter for iPhone,Guys this really needs to stop. We've been over this way too many times. This is a giraffe. We only rate dogs.. 7/10 https://t.co/yavgkHYPOC,7,10,,,https://pbs.twimg.com/media/CW4tL1vWcAIw1dw.jpg,dalmatian,2347,5208
679511351870550016,Twitter for iPhone,Say hello to William. He makes fun of others because he's terrified of his own deep-seated insecurities. 7/10 https://t.co/bwuV6FlRxr,7,10,william,,https://pbs.twimg.com/media/CW4b-GUWYAAa8QO.jpg,Chihuahua,1461,3711
679475951516934144,Twitter for iPhone,This is Evy. She doesn't want to be a Koala. 9/10 https://t.co/VITeF0Kl9L,9,10,evy,,https://pbs.twimg.com/media/CW37xZbUoAAUXe5.jpg,Maltese_dog,728,2304
679462823135686656,Twitter for iPhone,Meet Hurley. He's the curly one. He hugs every other dog he sees during his walk. 11/10 for spreading the love https://t.co/M6vqkt2GKV,11,10,hurley,,https://pbs.twimg.com/media/CW3v1KxW8AAIOuy.jpg,toy_poodle,21324,34856
679158373988876288,Twitter for iPhone,This is Rubio. He has too much skin. 11/10 https://t.co/NLOHmlENag,11,10,rubio,,https://pbs.twimg.com/media/CWza7kpWcAAdYLc.jpg,pug,9193,23568
679148763231985668,Twitter for iPhone,I know everyone's excited for Christmas but that doesn't mean you can send in reindeer. We only rate dogs... 8/10 https://t.co/eWjWgbOCYL,8,10,,,https://pbs.twimg.com/media/CWzSMmAWsAAyB1u.jpg,Italian_greyhound,1163,3028
679132435750195208,Twitter for iPhone,This is Louis. He's a river dancer. His friends think it's badass. All are very supportive. 10/10 for Louis https://t.co/qoIvjKMY58,10,10,louis,,https://pbs.twimg.com/media/CWzDWOkXAAAP0k7.jpg,Scottish_deerhound,1314,3253
679111216690831360,Twitter for iPhone,This is officially the greatest yawn of all time. 12/10 https://t.co/4R0Cc0sLVE,12,10,,,https://pbs.twimg.com/ext_tw_video_thumb/679111114081370114/pu/img/hFca8BHjRopgD0cM.jpg,kelpie,2893,6514
678991772295516161,Twitter for iPhone,If your Monday isn't going so well just take a look at this. Both 12/10 https://t.co/GJT6SILPGU,12,10,,,https://pbs.twimg.com/media/CWxDaXHWsAAWV8W.jpg,Eskimo_dog,1333,2537
678969228704284672,Twitter for iPhone,Meet Lola. She's a Metamorphic Chartreuse. Plays with her food. Insubordinate and churlish. Exquisite hardwood 11/10 https://t.co/etpBNXwN7f,11,10,lola,,https://pbs.twimg.com/media/CWwu6OLUkAEo3gq.jpg,Labrador_retriever,528,1796
678800283649069056,Twitter for iPhone,Here's a pupper with some mean tan lines. Snazzy sweater though 12/10 https://t.co/DpCSVsl6vu,12,10,,pupper,https://pbs.twimg.com/media/CWuVQSLW4AAI3w9.jpg,Labrador_retriever,1018,2810
678798276842360832,Twitter for iPhone,This is Linda. She fucking hates trees. 7/10 https://t.co/blaY85FIxR,7,10,linda,,https://pbs.twimg.com/media/CWuTbAKUsAAvZHh.jpg,Airedale,1350,3804
678774928607469569,Twitter for iPhone,This is Tug. He's not required to wear the cone he just wants his voice to project more clearly. 11/10 https://t.co/Sp739Ou2qx,11,10,tug,,https://pbs.twimg.com/media/CWt-MNIWEAAUC9S.jpg,Pembroke,1043,3037
678764513869611008,Twitter for iPhone,"Meet Wilson. He got caught humping the futon. He's like ""dude, help me out here"" 10/10 I'd help Wilson out https://t.co/m6XoclB0qv",10,10,wilson,,https://pbs.twimg.com/media/CWt0ubZWcAAkFER.jpg,Irish_terrier,544,1788
678755239630127104,Twitter for iPhone,This is Dash. He didn't think the water would be that cold. Damn it Dash it's December. Think a little. 10/10 https://t.co/NqcOwG8pxW,10,10,dash,,https://pbs.twimg.com/media/CWtsSQAUkAAnWws.jpg,malamute,3741,7802
678643457146150913,Twitter for iPhone,Meet Grizz. He just arrived. Couldn't wait until Christmas. Worried bc he saw the swastikas on the carpet. 10/10 https://t.co/QBGwYrT7rv,10,10,grizz,,https://pbs.twimg.com/media/CWsGnyMVEAAM1Y1.jpg,Labrador_retriever,489,2250
678446151570427904,Twitter for iPhone,Touching scene here. Really stirs up the emotions. The bond between father &amp; son. So beautiful. 10/10 for both pups https://t.co/AJWJHov5gx,10,10,,,https://pbs.twimg.com/media/CWpTLOYWsAEDhcU.jpg,Staffordshire_bullterrier,1785,4358
678424312106393600,Twitter for iPhone,This is Crystal. She's a shitty fireman. No sense of urgency. People could be dying Crystal. 2/10 just irresponsible https://t.co/rtMtjSl9pz,2,10,crystal,,https://pbs.twimg.com/media/CWo_T8gW4AAgJNo.jpg,Maltese_dog,2880,5916
678410210315247616,Twitter for iPhone,Say hello to Jerome. He can shoot french fries out of his mouth at insane speeds. Deadly af. 10/10 https://t.co/dIy88HwrX8,10,10,jerome,,https://pbs.twimg.com/media/CWoyfMiWUAAmGdd.jpg,schipperke,2072,4640
678396796259975168,Twitter for iPhone,These little fellas have opposite facial expressions. Both 12/10 https://t.co/LmThv0GWen,12,10,,,https://pbs.twimg.com/media/CWomSU_XIAAUYiK.jpg,Pembroke,478,1731
678389028614488064,Twitter for iPhone,"This is Bella. She just learned that her final grade in chem was a 92.49 
poor pupper 11/10 https://t.co/auOoKuoveM",11,10,bella,pupper,https://pbs.twimg.com/media/CWofOHUWUAACGVa.jpg,miniature_pinscher,473,2044
678341075375947776,Twitter for iPhone,This pupper likes tape. 12/10 https://t.co/cSp6w5GWgm,12,10,,pupper,https://pbs.twimg.com/media/CWnznDTU4AAa-6P.jpg,golden_retriever,612,1896
678334497360859136,Twitter for iPhone,This is Rosie. She has a snazzy bow tie and a fin for a tail. Probably super fast underwater. Cool socks 10/10 https://t.co/GO76MdGBs0,10,10,rosie,,https://pbs.twimg.com/media/CWntoDVWcAEl3NB.jpg,Norfolk_terrier,304,1427
678278586130948096,Twitter for iPhone,Another spooky pupper here. Most definitely floating. No legs. Probably knows some dark magic. 10/10 very spooked https://t.co/JK8MByRzgj,10,10,,pupper,https://pbs.twimg.com/media/CWm6xySUEAAqfFU.jpg,Maltese_dog,6857,12531
678255464182861824,Twitter for iPhone,This is Jessifer. She is a Bismoth Teriyaki. Flowers being attacked by hurricanes on bandana (rad). 9/10 stellar pup https://t.co/nZhmRwZzWv,9,10,jessifer,,https://pbs.twimg.com/media/CWmlvxJU4AEAqaN.jpg,Chihuahua,418,1726
678021115718029313,Twitter for iPhone,This is Reese. He likes holding hands. 12/10 https://t.co/cbLroGCbmh,12,10,reese,,https://pbs.twimg.com/media/CWjQm5gXAAA9GkD.jpg,miniature_pinscher,7148,15018
677918531514703872,Twitter for iPhone,"""Everything looks pretty good in there. Make sure to brush your gums. Been flossing? How's school going?"" Both 10/10 https://t.co/lWL2IMJqLR",10,10,,,https://pbs.twimg.com/media/CWhzTbzWUAAEAUN.jpg,Eskimo_dog,463,1476
677895101218201600,Twitter for iPhone,Guys this was terrifying. Really spooked me up. We don't rate ghosts. We rate dogs. Please only send dogs... 9/10 https://t.co/EJImi1udYb,9,10,,,https://pbs.twimg.com/media/CWhd_7WWsAAaqWG.jpg,dalmatian,2384,5275
677700003327029250,Twitter for iPhone,This is Ralph. He's an interpretive dancer. 10/10 https://t.co/zoDdPyPFsa,10,10,ralph,,https://pbs.twimg.com/media/CWesj06W4AAIKl8.jpg,Siberian_husky,1622,3689
677698403548192770,Twitter for iPhone,This is Sadie. She got her holidays confused. 9/10 damn it Sadie https://t.co/fm7HxOsuPK,9,10,sadie,,https://pbs.twimg.com/media/CWerGmOXAAAm6NY.jpg,Shih-Tzu,363,1332
677687604918272002,Twitter for iPhone,This was Cindy's face when she heard Susan forgot the snacks for after the kid's soccer game. 11/10 https://t.co/gzkuVGRgAD,11,10,,,https://pbs.twimg.com/media/CWehRdEWIAAySyO.jpg,Pembroke,950,2681
677673981332312066,Twitter for iPhone,Endangered triangular pup here. Could be a wizard. Caught mid-laugh. No legs. Just fluff. Probably a wizard. 9/10 https://t.co/GFVIHIod0Z,9,10,,,https://pbs.twimg.com/media/CWeU5LBWEAA8F0J.jpg,Maltese_dog,1677,3603
677644091929329666,Twitter for iPhone,This is a dog swinging. I really enjoyed it so I hope you all do as well. 11/10 https://t.co/Ozo9KHTRND,11,10,,,https://pbs.twimg.com/ext_tw_video_thumb/677644010865999872/pu/img/zVHEMYnJKzq1SauT.jpg,Chihuahua,886,2040
677565715327688705,Twitter for iPhone,Contortionist pup here. Inside pentagram. Clearly worships Satan. Known to slowly push fragile stuff off tables 6/10 https://t.co/EX9oR55VMe,6,10,,,https://pbs.twimg.com/media/CWcybBmWcAAigAQ.jpg,basset,513,1409
677547928504967168,Twitter for iPhone,Not much to say here. I just think everyone needs to see this. 12/10 https://t.co/AGag0hFHpe,12,10,,,https://pbs.twimg.com/media/CWciPonWEAUOqLD.jpg,American_Staffordshire_terrier,4076,7568
677530072887205888,Twitter for iPhone,Say hello to Axel. He's a Black Chevy Pinot on wheels. 0 to 60 in 5.7 seconds (if downhill). 9/10 I call shotgun https://t.co/DKe9DBnnHE,9,10,axel,,https://pbs.twimg.com/media/CWcSAI-WUAAOB9W.jpg,Staffordshire_bullterrier,250,1161
677334615166730240,Twitter for iPhone,This dog gave up mid jump. 9/10 https://t.co/KmMv3Y2zI8,9,10,,,https://pbs.twimg.com/media/CWZgPPUWUAAUOvu.jpg,Lakeland_terrier,328,1477
677331501395156992,Twitter for iPhone,Meet Humphrey. He's a Northern Polyp Viagra. One ear works. Face stuck like that. Always surprised. 9/10 petable af https://t.co/FS7eJQM2F4,9,10,humphrey,,https://pbs.twimg.com/media/CWZdaGxXAAAjGjb.jpg,beagle,265,1189
677314812125323265,Twitter for iPhone,"Meet Tassy &amp; Bee. Tassy is pretty chill, but Bee is convinced the Ruffles are haunted. 10/10 &amp; 11/10 respectively https://t.co/fgORpmTN9C",10,10,tassy,,https://pbs.twimg.com/media/CWZOOIUW4AAQrX_.jpg,Blenheim_spaniel,611,1799
677301033169788928,Twitter for iPhone,This is Juckson. He's totally on his way to a nascar race. 5/10 for Juckson https://t.co/IoLRvF0Kak,5,10,juckson,,https://pbs.twimg.com/media/CWZBsjPWsAAZFFl.jpg,Japanese_spaniel,471,1362
677269281705472000,Twitter for iPhone,This is the happiest pupper I've ever seen. 10/10 would trade lives with https://t.co/ep8ATEJwRb,10,10,,pupper,https://pbs.twimg.com/media/CWYk0WxWoAAEwRt.jpg,Shetland_sheepdog,790,2164
677187300187611136,Twitter for iPhone,Here we see a Byzantine Rigatoni. Very aerodynamic. No eyes. Actually not windy here they just look like that. 9/10 https://t.co/gzI0m6wXRo,9,10,,,https://pbs.twimg.com/media/CWXaQMBWcAAATDi.jpg,English_setter,1033,2981
676975532580409345,Twitter for iPhone,This is Cooper. He doesn't know how cheese works. Likes the way it feels on his face. Cheeky tongue slip. 11/10 https://t.co/j1zczS0lI5,11,10,cooper,,https://pbs.twimg.com/media/CWUZpydWcAAeipD.jpg,malamute,1203,3015
676957860086095872,Twitter for iPhone,10/10 I'd follow this dog into battle no questions asked https://t.co/ngTNXYQF0L,10,10,,,https://pbs.twimg.com/ext_tw_video_thumb/676957802976419840/pu/img/dCj-qlXo73A5hf6Q.jpg,Labrador_retriever,907,2395
676949632774234114,Twitter for iPhone,This is Tyrus. He's a Speckled Centennial Ticonderoga. Terrified of floating red ball. Nifty bandana. 8/10 v petable https://t.co/HqM3YhCaaa,8,10,tyrus,,https://pbs.twimg.com/media/CWUCGMtWEAAjXnS.jpg,Welsh_springer_spaniel,448,1413
676946864479084545,Twitter for iPhone,This pups goal was to get all four feet as close to each other as possible. Valiant effort 12/10 https://t.co/2mXALbgBTV,12,10,,,https://pbs.twimg.com/media/CWT_lOQWUAAXPaY.jpg,Pekinese,426,1844
676936541936185344,Twitter for iPhone,Here we see a rare pouched pupper. Ample storage space. Looks alert. Jumps at random. Kicked open that door. 8/10 https://t.co/mqvaxleHRz,8,10,,pupper,https://pbs.twimg.com/media/CWT2MUgWIAECWig.jpg,Chesapeake_Bay_retriever,5515,13809
676864501615042560,Twitter for iPhone,Meet Ash. He's just a head now. Lost his body during the Third Crusade. Still in good spirits. 10/10 would pet well https://t.co/NJj2uP0atK,10,10,ash,,https://pbs.twimg.com/media/CWS0q8iU8AE2Srr.jpg,Chesapeake_Bay_retriever,808,2294
676821958043033607,Twitter for iPhone,Finally some constructive political change in this country. 11/10 https://t.co/mvQaETHVSb,11,10,,,https://pbs.twimg.com/media/CWSN-vaXAAA8Ehr.jpg,Great_Pyrenees,17605,25124
