tweet_id,source,text,rating_numerator,rating_denominator,dog_name,dog_class,jpg_url,dog_breed,retweet_count,favorite_count
791672322847637504,Twitter for iPhone,When she says you're a good boy and you know you're a good boy because you're a good boy. 13/10 https://t.co/O5IUmRHRIh,13,10,,,https://pbs.twimg.com/media/CvyVxQRWEAAdSZS.jpg,golden_retriever,3661,13129
791406955684368384,Twitter for iPhone,Say hello to Levi. He's a Madagascan Butterbop. One of the more docile Butterbops I've seen. 12/10 would give all the pets https://t.co/Zcw9Sccctc,12,10,levi,,https://pbs.twimg.com/media/CvukbEkWAAAV-69.jpg,Pembroke,4797,14670
791312159183634433,Twitter for iPhone,This is Mabel. She's super h*ckin smol. Portable af. Comes with the smol shoe. 12/10 would keep in frocket https://t.co/GGJvxYt3xK,12,10,mabel,,https://pbs.twimg.com/media/CvtONV4WAAAQ3Rn.jpg,miniature_pinscher,2963,9841
790987426131050500,Twitter for iPhone,This is Misty. She has a cowboy hat on her nose. 12/10 https://t.co/Eno0mypHIr,12,10,misty,,https://pbs.twimg.com/media/Cvom3ZJXEAE29TD.jpg,cocker_spaniel,2483,11089
790698755171364864,Twitter for iPhone,This is Mosby. He appears to be rather h*ckin snuggable af. 12/10 keep it up Mosby https://t.co/IiiBq460I7,12,10,mosby,,https://pbs.twimg.com/media/CvkgUjbUsAEvo7l.jpg,Bernese_mountain_dog,2203,9158
790337589677002753,Twitter for iPhone,Meet Maggie. She can hear your cells divide. 12/10 can also probably fly https://t.co/ovE2hqXryV,12,10,maggie,,https://pbs.twimg.com/media/CvfX2AnWYAAQTay.jpg,Pembroke,2167,8740
790277117346975746,Twitter for iPhone,This is Bruce. He never backs down from a challenge. 11/10 you got this Bruce https://t.co/aI7umZHIq7,11,10,bruce,,https://pbs.twimg.com/media/Cveg1-NXgAASaaT.jpg,Labrador_retriever,3732,14081
789628658055020548,Twitter for iPhone,This is Eli. He can fly. 13/10 magical af https://t.co/huPSJJ7FDI,13,10,eli,,https://pbs.twimg.com/media/CvVTEnPXYAAWLyL.jpg,chow,2080,8448
789599242079838210,Twitter for iPhone,This is Brownie. She's wearing a Halloween themed onesie. 12/10 festive af https://t.co/0R4meWXFOx,12,10,brownie,,https://pbs.twimg.com/media/CvU4UZpXgAE1pAV.jpg,Chesapeake_Bay_retriever,2279,7620
789530877013393408,Twitter for iPhone,This is Rizzy. She smiles a lot. 12/10 contagious af https://t.co/TU4sZogVIq,12,10,rizzy,,https://pbs.twimg.com/media/CvT6IV6WEAQhhV5.jpg,schipperke,3942,13188
789268448748703744,Twitter for iPhone,This is Stella. She's happier than I will ever be. 10/10 would trade lives with https://t.co/JSs2bfDtTS,10,10,stella,,https://pbs.twimg.com/media/CvQLdotWcAAZn86.jpg,malamute,3014,10196
789137962068021249,Twitter for iPhone,This is Bo. He's a West Congolese Bugaboop Snuggle. Rather exotic. Master of the head tilt. 12/10 would pay to pet https://t.co/2jwxxtNzoN,12,10,bo,,https://pbs.twimg.com/media/CvOUw8vWYAAzJDq.jpg,Chihuahua,3244,10875
788765914992902144,Twitter for iPhone,This is Butter. She can have whatever she wants forever. 12/10 would hug softly https://t.co/x5gXRS1abq,12,10,butter,,https://pbs.twimg.com/media/CvJCabcWgAIoUxW.jpg,cocker_spaniel,12014,30658
788412144018661376,Twitter for iPhone,This is Dexter. He breaks hearts for a living. 11/10 h*ckin handsome af https://t.co/4DhSsC1W7S,11,10,dexter,,https://pbs.twimg.com/media/CvEAqQoWgAADj5K.jpg,golden_retriever,5990,16060
788178268662984705,Twitter for iPhone,Atlas is back and this time he's got doggles. Still 13/10 solarly conscious af https://t.co/s7MgFWDySc,13,10,,,https://pbs.twimg.com/media/CvAr88kW8AEKNAO.jpg,Samoyed,2488,8100
788150585577050112,Twitter for iPhone,This is Leo. He's a golden chow. Rather h*ckin rare. 13/10 would give extra pats https://t.co/xosHjFzVXc,13,10,leo,,https://pbs.twimg.com/media/CvASw6dWcAQmo3X.jpg,chow,1510,6865
787810552592695296,Twitter for iPhone,This is Frank. He wears sunglasses and walks himself. 11/10 I'll never be this cool or independent https://t.co/pNNjBtHWPc,11,10,frank,,https://pbs.twimg.com/media/Cu7dg2RXYAIaGXE.jpg,pug,3540,9717
787717603741622272,Twitter for iPhone,This is Tonks. She is a service puppo. Can hear a caterpillar hiccup from 7 miles away. 13/10 would follow anywhere https://t.co/i622ZbWkUp,13,10,tonks,puppo,https://pbs.twimg.com/media/Cu6I9vvWIAAZG0a.jpg,German_shepherd,3240,11416
787397959788929025,Twitter for iPhone,This is Moose. He's rather h*ckin dangerous (you can tell by the collar). 11/10 would still attempt to snug https://t.co/lHVHGdDzb3,11,10,moose,,https://pbs.twimg.com/media/Cu1mQsDWEAAU_VQ.jpg,Chihuahua,3300,12120
786963064373534720,Twitter for iPhone,This is Rory. He's got an interview in a few minutes. Looking spiffy af. Nervous as h*ck tho. 12/10 would hire https://t.co/ibj5g6xaAj,12,10,rory,,https://pbs.twimg.com/media/Cuvau3MW8AAxaRv.jpg,golden_retriever,9327,29725
786709082849828864,Twitter for iPhone,"This is Logan, the Chow who lived. He solemnly swears he's up to lots of good. H*ckin magical af 9.75/10 https://t.co/yBO5wuqaPS",75,10,logan,,https://pbs.twimg.com/media/CurzvFTXgAA2_AP.jpg,Pomeranian,7069,20296
786664955043049472,Twitter for iPhone,"""Honestly Kathleen I just want more Ken Bone"" 12/10 https://t.co/HmlEvAMP4r",12,10,,,https://pbs.twimg.com/media/CurLmoqXgAEPoJ-.jpg,Leonberg,2996,11957
786595970293370880,Twitter for iPhone,This is Dale. He's a real spookster. Did me quite the frighten. 11/10 not too spooky to pet tho https://t.co/L8BWDD4oBX,11,10,dale,,https://pbs.twimg.com/media/CuqM0fVWAAAboKR.jpg,Pembroke,3601,10497
786363235746385920,Twitter for iPhone,This is Rizzo. He has many talents. A true renaissance doggo. 13/10 entertaining af https://t.co/TVXpEJB7Wn,13,10,rizzo,doggo,https://pbs.twimg.com/media/Cum5LlfWAAAyPcS.jpg,golden_retriever,4072,12189
786233965241827333,Twitter for iPhone,This is Mattie. She's extremely dangerous. Will bite your h*ckin finger right off. Still 11/10 would pet with caution https://t.co/78c9W8kLFh,11,10,mattie,,https://pbs.twimg.com/media/CulDnZpWcAAGbZ-.jpg,Labrador_retriever,5571,17178
785872687017132033,Twitter for iPhone,Meet Rusty. He appears to be rather h*ckin fluffy. Also downright adorable af. 12/10 would rub my face against his https://t.co/1j9kLGb4wV,12,10,rusty,,https://pbs.twimg.com/ext_tw_video_thumb/785872596088811520/pu/img/5O-_BgqdFQu_2Bt7.jpg,Great_Pyrenees,2130,7489
785533386513321988,Twitter for iPhone,This is Dallas. Her tongue is ridiculous. 11/10 h*ckin proud af https://t.co/h4jhlH4EyG,11,10,dallas,,https://pbs.twimg.com/media/CubGchjXEAA6gpw.jpg,miniature_pinscher,2334,10183
784826020293709826,Twitter for iPhone,This is Rusty. He's going D1 for sure. Insane vertical. 13/10 would draft https://t.co/AsykOwMrXQ,13,10,rusty,,https://pbs.twimg.com/media/CuRDF-XWcAIZSer.jpg,chow,3712,11310
784517518371221505,Twitter for iPhone,This is Frankie. He has yet to learn how to control his tongue. 11/10 maybe one day https://t.co/p6fgYe2dB6,11,10,frankie,,https://pbs.twimg.com/media/CuMqhGrXYAQwRqU.jpg,malamute,2970,10039
784431430411685888,Twitter for iPhone,This is Stormy. He's curly af. Already pupared for Coachella next year. 12/10 https://t.co/PHA1vtqqpt,12,10,stormy,,https://pbs.twimg.com/media/CuLcNkCXgAEIwK2.jpg,miniature_poodle,1491,6329
783821107061198850,Twitter for iPhone,This is Mairi. She has mastered the art of camouflage. 12/10 h*ckin sneaky af https://t.co/STcPjiNAHp,12,10,mairi,,https://pbs.twimg.com/media/CuCxIzyWEAQTnQA.jpg,Lakeland_terrier,2269,8209
783695101801398276,Twitter for iPhone,This is Loomis. He's the leader of the Kenneth search party. The passion is almost overwhelming. 12/10 one day he will be free https://t.co/kCRKlFg4AY,12,10,loomis,,https://pbs.twimg.com/media/CuA-iRHXYAAWP8e.jpg,chow,3737,11650
783466772167098368,Twitter for iPhone,This is Finn. He likes eavesdropping from filing cabinets. It's a real issue but no one has approached him about it. 11/10 would still pet https://t.co/s8W8Del9HQ,11,10,finn,,https://pbs.twimg.com/media/Ct9u3ljW8AEnVIm.jpg,Chihuahua,2608,9468
783391753726550016,Twitter for iPhone,Meet Godi. He's an avid beachgoer and part time rainbow summoner. Eyeliner flawless af. 13/10 would snug well https://t.co/BO936YdJdi,13,10,godi,,https://pbs.twimg.com/media/Ct8qn8EWIAAk9zP.jpg,Norwegian_elkhound,6441,18908
783334639985389568,Twitter for iPhone,This is Dave. He's currently in a predicament. Doesn't seem to mind tho. 12/10 someone assist Dave https://t.co/nfprKAXqwu,12,10,dave,,https://pbs.twimg.com/media/Ct72q9jWcAAhlnw.jpg,Cardigan,13616,32651
783085703974514689,Twitter for iPhone,This is Earl. He can't catch. Did his best tho. 11/10 would repair confidence with extra pats https://t.co/IsqyvbjFgM,11,10,earl,,https://pbs.twimg.com/media/Ct4URfWUAAQ7lKe.jpg,Chesapeake_Bay_retriever,2565,9112
782747134529531904,Twitter for iPhone,This is Deacon. He's the happiest almost dry doggo I've ever seen. 11/10 would smile back https://t.co/C6fUMnHt1H,11,10,deacon,doggo,https://pbs.twimg.com/media/CtzgXgeXYAA1Gxw.jpg,golden_retriever,1604,8310
782722598790725632,Twitter for iPhone,"This is Penny. She fought a bee and the bee won. 10/10 you're fine Penny, everything's fine https://t.co/zrMVdfFej6",10,10,penny,,https://pbs.twimg.com/media/CtzKC7zXEAALfSo.jpg,Irish_setter,6238,19250
782598640137187329,Twitter for iPhone,This is Timmy. He's quite large. According to a trusted source it's actually a dog wearing a dog suit. 11/10 https://t.co/BIUchFwHqn,11,10,timmy,,https://pbs.twimg.com/media/CtxZTtxUMAEduGo.jpg,malamute,2184,8694
782305867769217024,Twitter for iPhone,This is Sampson. He just graduated. Ready to be a doggo now. Time for the real world. 12/10 have fun with taxes https://t.co/pgVKxRw0s1,12,10,sampson,doggo,https://pbs.twimg.com/media/CttPBt0WIAAcsDE.jpg,briard,6470,18630
781661882474196992,Twitter for iPhone,Who keeps sending in pictures without dogs in them? This needs to stop. 5/10 for the mediocre road https://t.co/ELqelxWMrC,5,10,,,https://pbs.twimg.com/media/CtkFS72WcAAiUrs.jpg,Pembroke,3129,11634
781251288990355457,Twitter for iPhone,This is Oakley. He just got yelled at for going 46 in a 45. Churlish af. 11/10 would still pet so well https://t.co/xIYsa6LPA4,11,10,oakley,,https://pbs.twimg.com/media/CteP5H5WcAEhdLO.jpg,Mexican_hairless,2458,9428
781163403222056960,Twitter for iPhone,"We normally don't rate lobsters, but this one appears to be a really good lobster. 10/10 would pet with caution https://t.co/YkHc7U7uUy",10,10,,,https://pbs.twimg.com/media/Ctc_-BTWEAAQpZh.jpg,Shetland_sheepdog,3168,10895
780858289093574656,Twitter for iPhone,"This is Dash. He's very stylish, but also incredibly unimpressed with the current state of our nation. 10/10 would pet ears first https://t.co/YElO4hvXI6",10,10,dash,,https://pbs.twimg.com/media/CtYqeNHWgAATqYZ.jpg,Chesapeake_Bay_retriever,2328,8033
780800785462489090,Twitter for iPhone,This is Koda. He has a weird relationship with tall grass. Slightly concerning. 11/10 would def still pet https://t.co/KQzSR8eCsw,11,10,koda,,https://pbs.twimg.com/media/CtX2Kr9XYAAuxrM.jpg,Siberian_husky,1505,6141
780601303617732608,Twitter for iPhone,Meet Hercules. He can have whatever he wants for the rest of eternity. 12/10 would snug passionately https://t.co/mH0IOyFdIG,12,10,hercules,,https://pbs.twimg.com/media/CtVAvX-WIAAcGTf.jpg,Saint_Bernard,3839,13525
780543529827336192,Twitter for iPhone,Here's a perturbed super floof. 12/10 would snug so damn well https://t.co/VG095mi09Q,12,10,,,https://pbs.twimg.com/media/CtUMLzRXgAAbZK5.jpg,golden_retriever,2032,7040
780459368902959104,Twitter for iPhone,"This is Bear. Don't worry, he's not a real bear tho. Contains unreal amounts of squish. 11/10 heteroskedastic af https://t.co/coi4l1T2Sm",11,10,bear,,https://pbs.twimg.com/media/CtS_p9kXEAE2nh8.jpg,Great_Dane,1224,5892
780192070812196864,Twitter for iPhone,We only rate dogs. Pls stop sending in non-canines like this Urban Floof Giraffe. I can't handle this. 11/10 https://t.co/zHIqpM5Gni,11,10,,,https://pbs.twimg.com/media/CtPMhwvXYAIt6NG.jpg,vizsla,2589,9712
779834332596887552,Twitter for iPhone,This is Scout. He really wants to kiss himself. H*ckin inappropriate. 11/10 narcissistic af https://t.co/x0gV2Ck3AD,11,10,scout,,https://pbs.twimg.com/media/CtKHLuCWYAA2TTs.jpg,golden_retriever,8237,21252
779123168116150273,Twitter for iPhone,This is Reggie. He hugs everyone he meets. 12/10 keep spreading the love Reggie https://t.co/uMfhduaate,12,10,reggie,,https://pbs.twimg.com/media/CtAAYizW8AAWzBZ.jpg,toy_poodle,4207,13206
779056095788752897,Twitter for iPhone,Everybody drop what you're doing and look at this dog. 13/10 must be super h*ckin rare https://t.co/I1bJUzUEW5,13,10,,,https://pbs.twimg.com/media/Cs_DYr1XEAA54Pu.jpg,Chihuahua,5247,16500
778990705243029504,Twitter for iPhone,This is Jay. He's really h*ckin happy about the start of fall. Sneaky tongue slip in 2nd pic. 11/10 snuggly af https://t.co/vyx1X5eyWI,11,10,jay,,https://pbs.twimg.com/media/Cs-H5uhWcAAiNY9.jpg,cocker_spaniel,8437,22342
778748913645780993,Twitter for iPhone,"This is Mya (pronounced ""mmmyah?""). Her head is round af. 11/10 would pat accordingly https://t.co/1dpEuALnY0",11,10,mya,,https://pbs.twimg.com/media/Cs6r_-kVIAALh1p.jpg,Staffordshire_bullterrier,1562,7717
778650543019483137,Twitter for iPhone,"Meet Strider. He thinks he's a sorority girl. Already wants to go to NYC for a weekend to say he's ""studied abroad"" 10/10 https://t.co/KYZkPuiC1l",10,10,strider,,https://pbs.twimg.com/media/Cs5ShihWEAAH2ti.jpg,German_shepherd,1729,6430
778624900596654080,Twitter for iPhone,This is Penny. She's a sailor pup. 11/10 would take to the open seas with https://t.co/0rRxyBQt32,11,10,penny,,https://pbs.twimg.com/media/Cs47N3eWcAEmgiW.jpg,Airedale,1176,5177
778408200802557953,Twitter for iPhone,RIP Loki. Thank you for the good times. You will be missed by many. 14/10 https://t.co/gJKD9pst5A,14,10,,,https://pbs.twimg.com/media/Cs12ICuWAAECNRy.jpg,Pembroke,5023,15135
778383385161035776,Twitter for iPhone,This is Nala. She's a future Dogue model. Won't respond to my texts. 13/10 would be an honor to pet https://t.co/zP1IvAATWv,13,10,nala,,https://pbs.twimg.com/media/Cs1fjyqWIAE2jop.jpg,collie,1271,6515
778286810187399168,Twitter for iPhone,This is Stanley. He has too much skin. Isn't happy about it. Quite pupset actually. Still 11/10 would comfort https://t.co/hhTfnPrWfb,11,10,stanley,,https://pbs.twimg.com/media/Cs0HuUTWcAUpSE8.jpg,Boston_bull,3836,11576
778039087836069888,Twitter for iPhone,Evolution of a pupper yawn featuring Max. 12/10 groundbreaking stuff https://t.co/t8Y4x9DmVD,12,10,,pupper,https://pbs.twimg.com/media/CswmaHmWAAAbdY9.jpg,German_shepherd,3065,9417
778027034220126208,Twitter for iPhone,This is Sophie. She's a Jubilant Bush Pupper. Super h*ckin rare. Appears at random just to smile at the locals. 11.27/10 would smile back https://t.co/QFaUiIHxHq,27,10,sophie,pupper,https://pbs.twimg.com/media/Cswbc2yWcAAVsCJ.jpg,clumber,1885,7320
777885040357281792,Twitter for iPhone,This is Wesley. He's clearly trespassing. Seems rather h*ckin violent too. Weaponized forehead. 3/10 wouldn't let in https://t.co/pL7wbMRW7M,3,10,wesley,,https://pbs.twimg.com/media/CsuaUH2WAAAWJh1.jpg,Afghan_hound,1893,7078
777684233540206592,Twitter for iPhone,"""Yep... just as I suspected. You're not flossing."" 12/10 and 11/10 for the pup not flossing https://t.co/SuXcI9B7pQ",12,10,,,https://pbs.twimg.com/media/CsrjryzWgAAZY00.jpg,cocker_spaniel,3403,12518
777621514455814149,Twitter for iPhone,This is Derek. You can't look at him and not smile. Must've just had a blue pupsicle. 12/10 would snug intensely https://t.co/BnVTMtUeI3,12,10,derek,,https://pbs.twimg.com/media/Csqqoo5WEAAMTVW.jpg,chow,2910,9742
777189768882946048,Twitter for iPhone,This is Jeffrey. He's being held so he doesn't fly away. 12/10 would set free https://t.co/d3aLyCykn7,12,10,jeffrey,,https://pbs.twimg.com/media/Cskh9nRWYAAUxBP.jpg,Chihuahua,4999,15921
776813020089548800,Twitter for iPhone,Meet Solomon. He was arrested for possession of adorable and attempted extra pats on the head. 12/10 would post bail https://t.co/nFqLaOLUQA,12,10,solomon,,https://pbs.twimg.com/media/CsfLUDbXEAAu0VF.jpg,toy_poodle,1405,5444
776477788987613185,Twitter for iPhone,This is Huck. He's addicted to caffeine. Hope it's not too latte to seek help. 11/10 stay strong pupper https://t.co/iJE3F0VozW,11,10,huck,pupper,https://pbs.twimg.com/media/CsaaaaxWgAEfzM7.jpg,Labrador_retriever,3249,9858
776218204058357768,Twitter for iPhone,Atlas rolled around in some chalk and now he's a magical rainbow floofer. 13/10 please never take a bath https://t.co/nzqTNw0744,13,10,,floofer,https://pbs.twimg.com/media/CsWuVEdWcAAqbe9.jpg,Samoyed,18497,33345
776201521193218049,Twitter for iPhone,This is O'Malley. That is how he sleeps. Doesn't care what you think about it. 10/10 comfy af https://t.co/Pq150LeRaC,10,10,o'malley,,https://pbs.twimg.com/media/CsWfKadWEAAtmlS.jpg,Rottweiler,2919,10681
775842724423557120,Twitter for iPhone,This is Blue. He was having an average day until his owner told him about Bront. 12/10 h*ckin hysterical af https://t.co/saRYTcxQeH,12,10,blue,,https://pbs.twimg.com/media/CsRY1jAWYAUOx55.jpg,chow,3116,13022
775364825476165632,Twitter for iPhone,This is Finley. He's an independent doggo still adjusting to life on his own. 11/10 https://t.co/7FNcBaKbci,11,10,finley,doggo,https://pbs.twimg.com/media/CsKmMB2WAAAXcAy.jpg,beagle,3472,8295
775085132600442880,Twitter for iPhone,This is Tucker. He would like a hug. 13/10 someone hug him https://t.co/wdgY9oHPrT,13,10,tucker,,https://pbs.twimg.com/media/CsGnz64WYAEIDHJ.jpg,chow,5488,17281
774757898236878852,Twitter for iPhone,This is Finley. She's a Beneboop Cumbersplash. 12/10 I'd do unspeakable things for Finley https://t.co/dS8SCbNF9P,12,10,finley,,https://pbs.twimg.com/media/CsB-MYiXgAEQU20.jpg,toy_poodle,2035,9462
774639387460112384,Twitter for iPhone,This is Sprinkles. He's trapped in light jail. 10/10 would post bail for him https://t.co/4s5Xlijogu,10,10,sprinkles,,https://pbs.twimg.com/media/CsASZqRW8AA3Szw.jpg,Walker_hound,2013,7508
774314403806253056,Twitter for iPhone,I WAS SENT THE ACTUAL DOG IN THE PROFILE PIC BY HIS OWNER THIS IS SO WILD. 14/10 ULTIMATE LEGEND STATUS https://t.co/7oQ1wpfxIH,14,10,,,https://pbs.twimg.com/media/Cr7q1VxWIAA5Nm7.jpg,Eskimo_dog,6478,24167
773922284943896577,Twitter for iPhone,"This is Heinrich (pronounced ""Pat""). He's a Botswanian Vanderfloof. Snazzy af bandana. 12/10 downright puptacular https://t.co/G56ikYAqFg",12,10,heinrich,,https://pbs.twimg.com/media/Cr2GNdlW8AAbojw.jpg,Pomeranian,1999,7110
773704687002451968,Twitter for iPhone,This is Loki. He knows he's adorable. One ear always pupared. 12/10 would snug in depicted fashion forever https://t.co/OqNggd4Oio,12,10,loki,,https://pbs.twimg.com/media/CrzATQqWAAEHq2t.jpg,silky_terrier,1891,7317
773670353721753600,Twitter for iPhone,This is Shakespeare. He appears to be maximum level pettable. Born with no eyes tho (tragic). 10/10 probably wise https://t.co/rA8WUVOLBr,10,10,shakespeare,,https://pbs.twimg.com/media/CryhFC0XEAA9wp_.jpg,Old_English_sheepdog,1501,5935
773547596996571136,Twitter for iPhone,This is Chelsea. She forgot how to dog. 11/10 get it together pupper https://t.co/nBJ5RE4yHb,11,10,chelsea,pupper,https://pbs.twimg.com/media/Crwxb5yWgAAX5P_.jpg,Norwegian_elkhound,7126,24553
773191612633579521,Twitter for iPhone,This is Grey. He's the dogtor in charge of your checkpup today. 12/10 I'd never miss an appointment https://t.co/9HEVPJEioD,12,10,grey,,https://pbs.twimg.com/media/CrrtqjdXEAINleR.jpg,Blenheim_spaniel,4736,11117
772826264096874500,Twitter for iPhone,"Meet Roosevelt. He's preparing for takeoff. Make sure tray tables are in their full pupright &amp; licked position
11/10 https://t.co/7CQkn3gHOQ",11,10,roosevelt,,https://pbs.twimg.com/media/CrmhYYIXEAEcyYY.jpg,basset,2669,8842
772581559778025472,Twitter for iPhone,Guys this is getting so out of hand. We only rate dogs. This is a Galapagos Speed Panda. Pls only send dogs... 10/10 https://t.co/8lpAGaZRFn,10,10,,,https://pbs.twimg.com/media/CrjC0JAWAAAjz6n.jpg,Newfoundland,1968,7192
772193107915964416,Twitter for iPhone,This is Willem. He's a Penn State pupper. Thinks the hood makes him more intimidating. It doesn't. 12/10 https://t.co/Dp0s7MRIHK,12,10,willem,pupper,https://pbs.twimg.com/media/Crdhh_1XEAAHKHi.jpg,Pembroke,1612,6665
772152991789019136,Twitter for iPhone,Here's a couple rufferees making sure all the sports are played fairly today. Both 10/10 would bribe with extra pets https://t.co/H9yjI9eo3A,10,10,,,https://pbs.twimg.com/media/Crc9DEoWEAE7RLH.jpg,golden_retriever,1300,4181
772117678702071809,Twitter for iPhone,Meet Jack. He's a Clemson pup. Appears to be rather h*ckin pettable. Almost makes me want to root for Clemson. 12/10 https://t.co/GHOfbTVQti,12,10,jack,,https://pbs.twimg.com/media/Crcc7pqXEAAM5O2.jpg,Labrador_retriever,848,4165
772114945936949249,Twitter for iPhone,This is Finn. He's very nervous for the game. Has a lot of money riding on it.10/10 would attempt to comfort https://t.co/CbtNfecWiT,10,10,finn,,https://pbs.twimg.com/media/Crcacf9WgAEcrMh.jpg,Chihuahua,546,3005
772102971039580160,Twitter for iPhone,This is Penny. She's an OU cheerleader. About to do a triple back handspring down the stairs. 11/10 hype af https://t.co/B2f3XkGU5c,11,10,penny,,https://pbs.twimg.com/media/CrcPjh0WcAA_SPT.jpg,Pembroke,1065,4448
771770456517009408,Twitter for iPhone,This is Davey. He'll have your daughter home by 8. Just a stand up pup. 11/10 would introduce to mom https://t.co/E6bGWf9EOm,11,10,davey,,https://pbs.twimg.com/media/CrXhIqBW8AA6Bse.jpg,papillon,3924,13356
771500966810099713,Twitter for iPhone,This is Dakota. He's just saying hi. That's all. 12/10 someone wave back https://t.co/1tWe5zZoHv,12,10,dakota,,https://pbs.twimg.com/media/CrTsCPHWYAANdzC.jpg,Labrador_retriever,3018,9167
771380798096281600,Twitter for iPhone,Meet Fizz. She thinks love is a social construct consisting solely of ideals perpetuated by mass media 11/10 woke af https://t.co/sPB5JMnWBn,11,10,fizz,,https://pbs.twimg.com/media/CrR-vVfXEAAk6Gg.jpg,collie,5912,11746
771102124360998913,Twitter for iPhone,This is Charlie. He works for @TODAYshow. Super sneaky tongue slip here. 12/10 would pet until someone made me stop https://t.co/K5Jo7QRCvA,12,10,charlie,,https://pbs.twimg.com/media/CrOBSfgXgAABsTE.jpg,Labrador_retriever,1663,6898
770787852854652928,Twitter for iPhone,This is Winston. His tongue has gone rogue. Doing him quite a frighten. 10/10 hang in there Winston https://t.co/d0QEbp78Yi,10,10,winston,,https://pbs.twimg.com/media/CrJjdZmXgAEWLSD.jpg,Bernese_mountain_dog,1415,5498
770772759874076672,Twitter for iPhone,This is Sebastian. He's super h*ckin fluffy. That's really all you need to know. 11/10 would snug intensely https://t.co/lqr0NdtwQo,11,10,sebastian,,https://pbs.twimg.com/media/CrJVupHXgAA4Dkk.jpg,chow,1626,5749
770293558247038976,Twitter for iPhone,This is Jackson. There's nothing abnormal about him. Just your average really good dog. 10/10 https://t.co/3fEPpj0KYw,10,10,jackson,,https://pbs.twimg.com/media/CrCh5RgW8AAXW4U.jpg,Italian_greyhound,1718,6923
770069151037685760,Twitter for iPhone,Say hello to Carbon. This is his first time swimming. He's having a h*ckin blast. 10/10 we should all be this happy https://t.co/mADHGenzFS,10,10,carbon,,https://pbs.twimg.com/media/Cq_Vy9KWcAIUIuv.jpg,Boston_bull,2651,8385
769940425801170949,Twitter for iPhone,This is Klein. These pics were taken a month apart. He knows he's a stud now. 12/10 total heartthrob https://t.co/guDkLrX8zV,12,10,klein,,https://pbs.twimg.com/media/Cq9guJ5WgAADfpF.jpg,miniature_pinscher,11131,34948
769695466921623552,Twitter for iPhone,This is Titan. He's trying to make friends. Offering up his favorite stick. 13/10 philanthropic af https://t.co/vhrkz0dK4v,13,10,titan,,https://pbs.twimg.com/media/Cq6B8V6XYAA1T1R.jpg,pug,1926,7101
769212283578875904,Twitter for iPhone,This is DonDon. He's way up but doesn't feel blessed. Rather uncomfortable actually. 12/10 I'll save you DonDon https://t.co/OCYLz3fjVE,12,10,dondon,,https://pbs.twimg.com/media/CqzKfQgXEAAWIY-.jpg,golden_retriever,1969,5980
768970937022709760,Twitter Web Client,This is Kirby. His bowl weighs more than him. 12/10 would assist https://t.co/UlB2mzw3Xs,12,10,kirby,,https://pbs.twimg.com/ext_tw_video_thumb/768967618174877700/pu/img/4wfsrs0ZnQ5pstXm.jpg,Pomeranian,7574,16017
768855141948723200,Twitter for iPhone,This is Jesse. He really wants a belly rub. Will be as cute as possible to achieve that goal. 11/10 https://t.co/1BxxcdVNJ8,11,10,jesse,,https://pbs.twimg.com/media/CquFrCKWAAAr32m.jpg,chow,1034,4660
768609597686943744,Twitter for iPhone,This is Lou. His sweater is too small and he already cut the tags off. Very very churlish. 10/10 would still pet https://t.co/dZPMLresEr,10,10,lou,,https://pbs.twimg.com/media/CqqmWa7WcAAIM-n.jpg,basenji,1382,4580
768596291618299904,Twitter for iPhone,Say hello to Oakley and Charlie. They're convinced that they each have their own stick. Nobody tell them. Both 12/10 https://t.co/J2AJdyxglH,12,10,oakley,,https://pbs.twimg.com/media/CqqaPjqWIAAOyNL.jpg,Great_Pyrenees,1473,5592
768473857036525572,Twitter for iPhone,Meet Chevy. He had a late breakfast and now has to choose between a late lunch or an early dinner. 11/10 very pupset https://t.co/goy9053wC7,11,10,chevy,,https://pbs.twimg.com/media/Cqoq5PGWAAA-U8T.jpg,Labrador_retriever,3958,15110
767754930266464257,Twitter for iPhone,This is Philbert. His toilet broke and he doesn't know what to do. Trying not to panic. 11/10 furustrated af https://t.co/Nb68IsVb9O,11,10,philbert,,https://pbs.twimg.com/media/CqedCQWWgAIab9L.jpg,vizsla,6221,17814
767500508068192258,Twitter for iPhone,This is Louie. He's making quite a h*ckin mess. Doesn't seem to care. 12/10 jubilant af https://t.co/Z2g2YWPzX2,12,10,louie,,https://pbs.twimg.com/media/Cqa1ofnXEAAG0yn.jpg,chow,2688,8295
